"title","author","text","edition","language_code","source_type","__index_level_0__"
Given the limited corpus of just 27 New Testament texts, generating new insights requires scholars to seek new angles of interpretation. The author invokes Paul Ricoeur’s concept of the “surplus of meaning” to refer to the inexhaustible potential of these texts. In South Africa, approaches like narratology, feminism, postcolonialism and gender studies have enriched the understanding of New Testament texts. One example is how a narratological reading of the Gospel of John provides new insight into the characterisation of Peter, revealing three distinct phases. In the first phase (chapters 1–6), Peter gets off to a “good start”. Jesus gives him the name Cephas (referring to a rock), creating an expectation of steadfastness, which Peter seems to fulfil when he acts as the loyal spokesman for the Twelve in John 6. In the second phase (chapters 13–18), things take a “bad turn”. Peter displays impulsiveness and an inability to understand Jesus during the foot-washing, and his role as spokesman is undermined by the “beloved disciple”. He rashly promises to lay down his life for Jesus, ironically using the same language as the Good Shepherd, a promise he fails to keep when he acts violently during Jesus’ arrest and subsequently denies Jesus three times. The third phase (chapters 20–21) depicts Peter’s restoration. He is the first disciple to enter the empty tomb, and in John 21 he is fully rehabilitated. The Good Shepherd commissions Peter as a shepherd of his sheep, and Jesus’ final words to him are, “Follow me!” The implication is important: To be a good shepherd to the believers, Peter must first become a good follower (or sheep) of the Good Shepherd.

A second example is the establishment of Biblical Spirituality as an academic subdiscipline, pioneered by Pieter G. de Villiers. This new field, developed in collaboration with international experts like Kees Waaijman, fills a significant gap by applying academic rigour to the study of spirituality in Biblical texts. Through a series of publications, this perspective has been shown to uncover important themes often overlooked in traditional exegesis, such as the emphasis on love and spiritual transformation within the otherwise polemical letter to the Galatians.

Understanding the state of scholarship as a catalyst for new insights

A comprehensive understanding of existing scholarship is crucial, not only to avoid redundancy but also to identify gaps where new contributions can be made. A prime example is Jan G. van der Watt’s groundbreaking research on Johannine ethics. By thoroughly reviewing the literature, he discovered that no monograph had ever been written on the topic, because many leading scholars believed ethics was not a central theme in John’s Gospel. Van der Watt’s own investigation proved this assumption wrong, leading him to uncover a detailed and nuanced “grammar of ethics” embedded in the text. This ethical framework is divinely originated, revealed through Jesus, requires faith, and is expressed in love, obedience, service, and discipleship. This seminal work originated from the identification of a clear gap in existing research. Similarly, examining the history of interpretation of Biblical texts over a long period can yield fresh insights by exposing scholars to different zeitgeists. For instance, studying commentaries on Philemon from the fourth to the eighteenth century revealed that the now popular idea that Onesimus intentionally fled to Paul was first proposed by a few early commentators like Ambrosiaster and Luther before being rediscovered in modern times.

Embracing the appropriation of texts as inherent to the discipline

Finally, the discipline must embrace the task of appropriating texts for the contemporary situation, moving beyond what a text meant to what it means today . This involves going beyond Krister Stendahl’s “descriptive task” to engage with what he referred to as the “hermeneutic question”. In South Africa, scholars have an opportunity to guide faith communities in critical reflection, helping them to move past simplistic readings of the Bible. This sometimes requires balancing a “compliant reading” of Biblical texts with a “resistant reading”. While a compliant reading takes the Biblical text seriously, a resistant reading adds another dimension by critically examining how texts portray “the Other”. Historically, the church needed a resistant reading to move away from the Bible’s outdated worldview and its acceptance of slavery. Furthermore, without a resistant reading of Biblical texts on sexuality and homosexuality, faith communities in our time will never be able to move beyond the current dead end created by a compliant reading strategy of these texts. The letter to Philemon also illustrates this tension. A compliant reading provides valuable lessons on love and community in the face of power abuse. However, a purely compliant reading was historically used to defend slavery, arguing that because Paul sent a runaway slave back, the institution was divinely willed. A resistant, postcolonial reading, such as that by Jeremy Punt, balances this by reading the text from a different perspective, namely recognising that the letter was written from the perspective of slave owners; it concerns Onesimus, but his perspective is nowhere to be found in the letter. Furthermore, interdisciplinary collaboration can significantly enrich the process of appropriating Biblical texts. The author describes a project on theological responses to the COVID-19 pandemic, undertaken with a systematic theologian, Rian Venter. While the Biblical scholars identified key themes like lament, mercy and hope, the systematic theologian offered a broader conceptual framework, emphasising the need for a comprehensive and coherent Trinitarian hermeneutic to connect the crisis to core Christian symbols of creation, brokenness, incarnation, and new creation. This collaboration demonstrates how a deeper, more constructive theological engagement with contemporary challenges is possible.

Keywords: appropriation of texts; hermeneutics; history of research; methodologies; New Testament Studies; original languages

Ek was bevoorreg om die afgelope 45 jaar betrokke te wees by die beoefening van Nuwe Testamentiese wetenskap – eers as nagraadse student en daarna as dosent. Ek het in die tagtigerjare van die vorige eeu ’n belangstelling in die vakgebied ontwikkel – ’n tydperk wat met reg as ’n goue era beskryf kan word. 1 In dié tydperk was daar ’n groot aantal akademiese poste beskikbaar. Die vakgebied is nie net by teologiese fakulteite gedoseer nie; omdat Bybelkunde ’n keusevak in staatskole was, is Bybelkunde by alle staatsuniversiteite aangebied, wat beteken het dat elkeen van hulle minstens een voltydse doseerpos in Nuwe Testament gehad het. Sedertdien het die situasie drasties verander, veral ná die afskaffing van Bybelkunde as ’n keusevak. Deesdae is daar nog by net enkele staatsuniversiteite voltydse doseerposte in Nuwe Testament beskikbaar. Ten spyte hiervan lewer Suid-Afrikaanse Nuwe Testamentici nog steeds ’n stewige bydrae tot die vakgebied; nie net plaaslik nie, maar ook internasionaal. Teen hierdie agtergrond wil ek die fokus in hierdie bydrae op die beoefening van die vakgebied laat val, en dan spesifiek op die vraag hoe ons as akademici die vakgebied op ’n sinvolle manier in Suid-Afrika kan beoefen. Hierdie bydrae 2 is grootliks gebaseer op my eie ervaring van die onderrig van en navorsing in die Nuwe Testament die afgelope paar dekades, en daarmee saam, die interaksie met talle vakgenote, in Suid-Afrika en oorsee.

Daar is vier aspekte wat belangrik is as ’n mens Nuwe Testamentiese wetenskap in Suid-Afrika beoefen, wat ek vervolgens bespreek.

2. Die vertrekpunt: ’n grondige ondersoek van die teks

Die eerste stap vir enige Ou of Nuwe Testamentikus moet altyd ’n deeglike ondersoek van die teks self wees. Voordat enige verdere navorsing, uitleg of toe-eiening van die teks oorweeg kan word, is dit noodsaaklik om die teks eers self sorgvuldig te bestudeer: die woorde of terme wat gebruik word, die grammatika, sintaksis, struktuur en stilistiese kenmerke van die teks. Dit behoort vanselfsprekend te wees dat hierdie soort verstaan van ’n teks moontlik is slegs indien dit in die oorspronklike taal bestudeer word. In ’n era waarin toegang tot inligting dikwels die ontwikkeling van kritiese-evaluasie-vaardighede oorskadu, raak dit egter al hoe moeiliker om mense van die noodsaak van die lees van ’n teks in die oorspronklike tale te oortuig. Tog bly dit waar dat dit van kardinale belang is om met die spreekwoordelike graaf en pik te begin as ’n mens ’n wesenlike bydrae tot die vakgebied wil lewer. Prakties beteken dit in ons geval dat daar altyd met die teks in sy oorspronklike taal (of tale) geworstel moet word. Soos Lodewyk Sutton (2023:4–5) onlangs in ’n belangrike bydrae oor die noodsaak van Bybelse tale vir nagraadse studieleiding in Ou en Nuwe Testamentiese studies betoog het, is vaardigheid in hierdie tale onmisbaar, nie net vir die akademiese studie van die Bybel nie, maar ook vir die prediking daarvan.

As ’n eerste illustrasie van die noodsaak van deeglike teksontleding gebruik ek ’n voorbeeld uit die werk van Hermie C. van Zyl. Ek het dit gereeld in my lesings oor die Sinoptiese probleem gebruik omdat dit vir studente duidelik wys dat sinvolle navorsing oor die Sinoptiese probleem eintlik net vanuit die Griekse teks gedoen kan word. In Van Zyl 3 (2015) se grondige ondersoek van die verhaal van die stilmaak van die storm wys hy onder andere op die manier waarop Matteus Markus se verhaal aangepas het toe hy dit oorgeneem het, om sodoende sy eie teologie te laat deurkom:

Van Zyl vestig die aandag op verskeie punte:

Soms loon dit ’n mens ook om ’n enkele sin of selfs ’n enkele woord deeglik te ondersoek. As tweede voorbeeld 4 kies ek die lig wat ’n enkele vers in Galasiërs kan werp op hoe Paulus oor geestelike transformasie gedink het. In Galasiërs 4:19 roep hy uit: τέκνα μου, οὓς πάλιν ὠδίνω μέχρις οὗ μορφωθῇ Χριστὸς ἐν ὑμῖν (“My kinders, ter wille van wie ek weer geboortepyne kry totdat Christus in julle gevorm word”). Een van die treffende aspekte van hierdie vers is die ingewikkelde manier waarop Paulus drie metafore gebruik: “kinders” (τέκνα 5 ); “ek kry geboortepyne / ek kraam” (ὠδίνω); en “Christus word in julle gevorm” (μορφωθῇ Χριστὸς ἐν ὑμῖν).

Die eerste metafoor waarmee Paulus die Galasiërs beskryf – “kinders” – is nie vreemd aan sy geskrifte nie. Hy gebruik dit ook in ander briewe, byvoorbeeld in 1 Tessalonisense 2:7 en 11, 1 Korintiërs 4:14, en Filemon 10. In sulke gevalle beklemtoon dit sy aktiewe rol as geestelike vader om mense tot geloof te lei (DeSilva 2018:386). In hierdie vers gebruik hy hierdie bekende metafoor om te verwys na die unieke band tussen hom en die Galasiërs en om die opregtheid van sy toegeneentheid teenoor hulle te beklemtoon, veral in teëstelling met die houding van sy teenstanders. Daarbenewens impliseer die metafoor ook sy gesag oor hulle as sy geestelike kinders. 6

In vers 19 voer hy (onverwags?) ’n moederlike metafoor in. Hy beeld homself nou uit as ’n moeder wat weer geboortepyne ervaar en in kraam vir dieselfde (!) kinders is. Die beeldspraak verskuif dus nie net van ’n vaderlike metafoor (Paulus as geestelike vader van die Galasiërs; “kinders”) na ’n moederlike een (Paulus as die een wat aan die Galasiërs geboorte gee) nie, maar sinspeel ook op ’n beduidende verandering in die verhouding tussen hulle. Dit beteken dat hulle nie meer sy geestelike kinders is nie, aangesien hy weer eens aan hulle geboorte moet skenk. In ’n sekere sin sou ’n mens selfs kon sê dat hulle geestelik gesproke nie meer lewe of bestaan nie omdat hy weer aan hulle geboorte moet skenk!

Die daaropvolgende metafoor (“Christus word in julle gevorm”) verskuif die fokus van Paulus as ’n moeder wat geboorte gee aan die Galasiërs na die Galasiërs self as dié in wie Christus nog gevorm moet word. Die uitdrukking wat hier gebruik word (μορφόω) is ’n hapax legomenon in die Nuwe Testament (en ook in die LXX). In die passief beteken dit letterlik “om vorm aan te neem” of “gevorm te word”. Dit word elders in die Griekse literatuur as beeld gebruik om na die vorming van embrio’s te verwys. 7 Gevolglik neem baie Nuwe Testamentici 8 aan dat dit in hierdie geval as ’n metafoor gebruik word om Christus treffend as ’n embrio binne-in die Galasiërs uit te beeld. Ander eksegete 9 wil die beeld nie te sterk beklemtoon nie, maar selfs in so ’n geval word dit steeds figuurlik en nie letterlik nie verstaan. Die kernpunt is dat daar in hierdie vers ’n verskuiwing van fokus voorkom wat genuanseerde lae van metaforiese betekenisse skep. Aanvanklik gebruik Paulus ’n vaderlike metafoor om die verhouding tussen hom as geestelike vader en die Galasiërs as sy geestelike kinders te beklemtoon. Dit word opgevolg deur ’n moederlike metafoor waarin hy as ’n barende moeder uitgebeeld word. Daarmee sinspeel hy daarop dat die geestelike ouer-kind-verhouding tussen hom en die Galasiërs verval het. Ten slotte fokus ’n derde metafoor op die Galasiërs self, en dit beklemtoon die noodsaak van hulle voortgaande geestelike transformasie, uitgebeeld as die “vorming” van Christus binne hulle.

Dit is ook belangrik om daarop te let dat ’n mens die drie metafore nie as ’n soort chronologiese ontwikkeling moet verstaan nie. Let veral op die woorde μέχρις οὗ (d.w.s. “totdat”) wat tussen die tweede en derde metafore gebruik word: τέκνα μου, οὓς πάλιν ὠδίνω μέχρις οὗ μορφωθῇ Χριστὸς ἐν ὑμῖν. Paulus ervaar geboortepyne en is in kraam totdat Christus in hulle gevorm is; met ander woorde, die geboortepyne sal eers ophou wanneer Christus in hulle 10 gevorm is. Die twee metafore verwys dus na dieselfde gebeurtenis, maar uit twee verskillende perspektiewe: aan die een kant na Paulus se verantwoordelikheid om aan die Galasiërs geboorte te skenk, en aan die ander kant na dit wat in/met die Galasiërs self gebeur. ’n Mens kan selfs sê dat al drie metafore na dieselfde saak verwys, maar uit drie verskillende perspektiewe: “kinders” dui op hulle (vorige) toestand van geestelike kindskap (verlede); “geboortepyne” op dit wat Paulus (en die Galasiërs) weer moet deurmaak sodat hulle geestelik hernu kan word (hede); en Christus wat in hulle “gevorm” word op dit wat hulle nog moet deurmaak (toekoms).

Verder help ’n deeglike ondersoek van die metafore in hierdie vers ’n mens om Paulus se siening van geestelike transformasie in hierdie brief beter te begryp. Die gelowiges in Galasië het ’n rampspoedige proses van geestelike agteruitgang beleef. Daarom beklemtoon Paulus in sy brief die begrip van geestelike bevryding (kyk byvoorbeeld 4:4–5). Volgens hom is dit die deurslaggewende maatstaf waarmee ’n mens tussen ware geestelike transformasie en geestelike agteruitgang kan onderskei. Die enigste oplossing vir die benarde omstandighede waarin die Galasiërs hulle bevind, is dus om weer van vooraf te begin. Paulus moet weer geestelik aan hulle “geboorte skenk”, en Christus moet weer in hulle “gevorm” word. Uit die res van die brief kan ’n mens die gevolgtrekking maak dat Paulus met Christus se vorming in die Galasiërs waarskynlik die tasbare teenwoordigheid van die opgestane Christus in hulle lewens in gedagte het. In Galasiërs 2:20 verwys hy byvoorbeeld na Christus wat “in” hom (ἐν ἐμοί) leef: Dit is nie meer hy wat leef nie, maar Christus wat in hom leef; die lewe wat hy nou in die vlees leef, is ’n lewe van geloof in die Seun van God wat hom liefgehad het en Homself vir hom gegee het. In 4:19 kom die idee van ’n geestelike dood nie voor nie, maar die verwysing na Christus wat “in” gelowiges is, is opvallend. Verder beklemtoon die metafoor in 4:19 die feit dat die geestelike transformasie ’n langdurige proses is (“… totdat Christus gevorm word”). Galasiërs help ons ook om sommige van die kenmerke van geestelike transformasie uit te lig: die dood aan die wet (= geestelike vryheid); ’n lewe wat konkreet “in die liggaam” (σάρξ) geleef word; sowel as belangrike begrippe soos geloof, liefde en genade. Paulus beklemtoon geestelike vryheid ook in die twee perikope net voor 4:12–20, en weer in die volgende perikoop, in welke geval dit uitloop op die oproep om standvastig te wees en nie weer deur die juk van geestelike slawerny belas te word nie (5:1). Verder maak hy dit ook duidelik dat hierdie geestelike vryheid in toom gehou moet word deur liefde 11 en die wandel volgens die Gees. As hierdie siening korrek is, is die proses van geestelike transformasie wat in 4:19 uitgebeeld word, ’n soort bestaan waarin die teenwoordigheid van die opgestane Christus konkreet in die alledaagse lewe van gelowiges sigbaar word – ’n lewe wat deur geloof, liefde en genade gedryf word en wat in ’n voortdurende stryd met die vlees verkeer, en waarin hulle doelbewus vir leiding deur die Gees moet kies (5:18).

3. Die weg tot die skep van nuwe kennis: die vind van nuwe perspektiewe

In die Nuwe Testamentiese wetenskap word navorsing beperk tot net 27 tekste, waarvan vier opvallend kort is (2 en 3 Johannes, Filemon en Judas). Ondanks hierdie beperkte korpus hou navorsers hulle al letterlik eeue lank besig met die skep van nuwe insigte oor hierdie tekste. Dat dit die geval is, dien as ’n uitstekende bewys van die korrektheid van die gedagte van “the surplus of meaning” wat Paul Ricoeur so treffend verwoord het. ’n Mens kan Ricoeur se opmerking oor hierdie begrip inderdaad direk toepas op die manier waarop Nuwe Testamentici die beskeie literêre korpus ondersoek: “The past is not simply exhausted, as the prophets of misfortune say; rather, it leaves behind a storehouse of inexhaustible potentialities” (Ricoeur 1995:176).

Maar hoe kry ’n mens toegang tot die “inexhaustible potentialities” van Nuwe Testamentiese tekste? Een van die doeltreffendste maniere om dit te doen is om doelbewus na ’n nuwe perspektief op die teks te soek. In Suid-Afrikaanse navorsing oor die Nuwe Testament is daar talle voorbeelde hiervan. So byvoorbeeld het nuwe perspektiewe soos feminisme, postkolonialisme, genderstudies en neurowetenskappe navorsers gehelp om ’n beter begrip van Paulus se briewe te kry. 12

As eerste voorbeeld om hierdie saak te illustreer, wys ek hoe ’n narratologiese lees van die Johannes-evangelie ’n mens help om nuwe insig te kry in die manier waarop Petrus in dié Evangelie uitgebeeld word. 13 So ’n lees van die Evangelie toon dat daar drie duidelike fases in die karakterisering van Petrus is.

Die eerste fase kan beskryf word as ’n “goeie begin” en speel in hoofstukke 1 tot 6 af. Tydens sy eerste ontmoeting met Jesus in 1:40–42 gee Jesus aan Petrus ’n nuwe naam, Sefas (wat “rots” beteken 14 ). Hierdie naamgewing skep by die leser die verwagting dat Petrus ’n beduidende en standvastige rol in die verhaal sal speel. Dié verwagting word oënskynlik in 6:60–71 bewaarheid waar vertel word dat baie dissipels Jesus verlaat, maar Petrus as die lojale woordvoerder vir die Twaalf optree en bely: “Here, na wie toe sal ons gaan? U het die woorde van die ewige lewe.” Op hierdie punt in die verhaal is die beeld wat van Petrus geskep word, dié van ’n lojale volgeling van Jesus en die segsman van die dissipels.

In die tweede fase (hoofstukke 13–18) neem dinge egter ’n slegte wending. In Johannes 13 kom ’n reeks negatiewe karaktertrekke van Petrus na vore. Tydens die voetwassing (13:1–20) toon hy ’n onvermoë om Jesus te verstaan en tree hy impulsief op. Sy posisie as segsman van die dissipels word ook ondermyn wanneer hy deur die “geliefde dissipel” aan Jesus ’n vraag moet stel (13:24), wat wys dat ’n ander dissipel ’n hegter verhouding met Jesus as hy het. Verder maak hy die roekelose voorspelling dat hy nie net vir Jesus sal volg nie, maar selfs sy lewe vir hom sal aflê (13:37). Wanneer hy hierdie belofte maak, gebruik hy presies dieselfde uitdrukking as wat Jesus in 10:11 gebruik het toe Hy gesê het dat die goeie herder sy lewe vir sy skape sal aflê. Petrus belowe: “Ek sal my lewe vir U aflê” (13:37: τὴν ψυχήν μου ὑπὲρ σοῦ θήσω; let op 10:11: τὴν ψυχὴν αὐτοῦ τίθησιν ὑπὲρ τῶν προβάτων). 15 Hierdeur beeld Petrus homself dus op ’n indirekte manier as ’n goeie herder uit (waarskynlik sonder om dit self te besef). Sy optrede is egter terselfdertyd ironies, want hy maak hierdie belofte juis op ’n stadium wanneer sy onvermoë om Jesus te verstaan en sy impulsiwiteit duidelik is. Die ironie word verder versterk deur Jesus se reaksie: In plaas daarvan om sy lewe af te lê, sal Petrus Hom verloën (13:38). Dit is verder ook belangrik om op die woord ἀκολουθέω (“volg”) te let. In 10:4 word dit gebruik om die verhouding tussen die skape en die goeie herder te beskryf: Die skape van die goeie herder “volg” Hom. In 13:36 sê Jesus vir Petrus dat hy Hom nie nou kan volg nie, waarop Petrus protesteer. Hy sal nie net vir Jesus volg (soos ’n skaap die goeie herder volg nie), maar selfs sy lewe vir Hom aflê (soos wat ’n goeie herder maak). Wanneer ’n mens die verhaal van Jesus se gevangeneming in Johannes 18 teen hierdie agtergrond lees, kry ’n mens dieselfde teëstelling: Jesus tree inderdaad soos ’n goeie herder op wat bereid is om sy lewe vir sy skape af te lê. 16 Petrus, die selfverklaarde “goeie herder”, doen egter presies die teenoorgestelde: Hy veg vir sy lewe en versuim om sy belofte na te kom. Petrus tree verder gewelddadig op tydens Jesus se arrestasie, word deur Jesus tereggewys, en vervul dan Jesus se voorspelling deur Hom drie keer te verloën.

In die derde fase (hoofstukke 20 en 21) word Petrus se herstel uitgebeeld. In hoofstuk 20 vind ons die eerste stap: Petrus en die “ander dissipel” (waarskynlik die “geliefde dissipel”) hardloop saam na Jesus se graf. Die ander dissipel kom eerste by die graf aan, maar Petrus is die een wat eerste die leë graf binnegaan (20:6). In hoofstuk 21 vind sy volledige herstel plaas. Wanneer die dissipels besef dat dit Jesus is wat op die strand staan, is dit Petrus wat sy klere aantrek en na die strand swem (21:7) – ’n aanduiding van sy bereidheid om vir Jesus te werk (Busse 2002:288). 17 In 21:15–9 vind daar nog ’n betekenisvolle gebeurtenis plaas: Jesus herstel Petrus in sy posisie. Soos wat baie geleerdes 18 reeds aangetoon het, speel “herdertaal” ’n belangrike rol in die gesprek tussen Jesus en Petrus. Die leser sien hoe Jesus, die Goeie Herder, vir Petrus in diens neem as herder van sy (Jesus se) skape. Verder word die roekelose belofte wat Petrus in 13:36 gemaak het, nou weer opgeneem. Petrus sal uiteindelik soos ’n goeie herder optree: Hy sal (ook) sy lewe aflê (21:18–9). Dit is ook belangrik om daarop te let dat Jesus se laaste woorde aan Petrus in die Johannes-evangelie “Volg my!” is (ἀκολούθει μοι; 21:19). Hier kry ons dus weer die woord ἀκολουθέω wat vroeër gebruik is om die optrede van die goeie herder se skape te beskryf. Die implikasie is duidelik: Petrus kan sy opdrag as herder van Jesus se kudde suksesvol uitvoer slegs as hy self eers leer om te doen wat van ’n goeie skaap verwag word: om die Goeie Herder onvoorwaardelik te volg. Om ’n goeie herder vir die gelowiges te wees, moet Petrus ’n goeie volgeling van die Goeie Herder wees.

