"title","author","text","edition","language_code","source_type","__index_level_0__"
"Suid-Afrika as ’n misdaadstaat – ’n kritiese beoordeling
","André Duvenhage
"," Suid-Afrika as ’n misdaadstaat – ’n kritiese beoordeling 1

André Duvenhage, navorsingsprofessor, Noordwes-Universiteit (Potchefstroomkampus)

Die begrip misdaadstaat (ook genoem mafiastaat of pakhanate ) het geen bekendstelling nodig nie. Histories is dit geassosieer met onder meer Rusland, Italië en Japan. Meer hedendaags kan talle state as misdaadstate beskryf word, hoewel die graad daarvan mag verskil. In ’n wêreld waar ’n “revolusie van misdaad” aan die orde van die dag is, is die begrip en sy betekenis nie net van toepassing op sommige Afrikastate soos die Demokratiese Republiek die Kongo en Nigerië nie, maar in besonder ook Suid-Afrika. GI-TOC se gesaghebbende Global Organized Crime Index (2023) plaas Suid-Afrika wat beide gewone en georganiseerde misdaad betref, sewende in die wêreld, in die geselskap van byvoorbeeld Venezuela, Afganistan en El Salvador. Hierdie perspektief word verder bevestig deur die voorkoms van tallose skandale, waaronder die wapenskandaal, Oilgate, Travelgate en vele ander soos ondersteun deur die bevindinge van die Zondo-kommissie. Laasgenoemde verslag dui op uitgebreide vorme van endemiese en sistemiese korrupsie – ook bekend as staatskaping. As staat weerspieël Suid-Afrika ook die eienskappe wat met misdaadstate geassosieer word. Dit is onlangs verder bevestig deur die uitsprake van luitenant-generaal Nhlanhla Mkhwanazi wat korrupsie op die hoogste vlak binne die Suid-Afrikaanse Polisiediens (SAPD) impliseer, en wat daartoe gelei het dat die betrokke minister, Senzo Mchunu, op verpligte verlof geplaas is hangende bepaalde ondersoeke. 2

Die doel van hierdie navorsing is nie net om aan te dui of Suid-Afrika kwalifiseer om as ’n misdaadstaat geïdentifiseer te word nie, maar ’n ontleding en beoordeling van die praktyk in Suid Afrika. Die skepping van ’n normatiewe raamwerk ten opsigte van die staat (kenmerke, funksies en take) sal as grondslag gebruik word om die onderskeidende aard van misdaadstate te identifiseer, met ander woorde wat hierdie kategorie eiesoortig maak, maar ook andersoortig ooreenkomstig dít wat vroeër met nasiestate geassosieer is. Anders as my vorige navorsing oor die klassifikasie van Suid-Afrika binne die kategorie van misdaadstate is hierdie artikel toegespits op ’n meer uitgebreide toepassing van die misdaadstaatkonteks. Daar word veral gekonsentreer op die funksionering (aard en werking) van misdaadtendense binne die Suid-Afrikaanse politieke konteks en die implikasies daarvan vir die demokratiese politieke bestel. Die ondersoek is ’n literatuurstudie, kwalitatief van aard, deduktief (dit werk vanuit ’n bepaalde ontledingsraamwerk), terwyl verifiëring kwalitatief (normatief) van aard is met die gebruik van data, syfers en inligting wat as motivering en bewysgrond sal dien.

Fokuspunte van die navorsing sluit in:

Trefwoorde: kaderontplooiing; konstruksiemafia; mafiastaat; misdaadstaat; nasiestaat; pakhanate; politieke sluipmoorde; staatskaping; swak/mislukte staat; Zondo-kommissie van ondersoek

South Africa as a criminal state – a critical evaluation

The concept of a criminal state (also referred to as a mafia state or pakhanate ) is well known. Historically it has been associated with states like Russia, Italy and Japan. Currently many states can be described as criminal states, although there may be differences in degrees of criminality. In a world accustomed to a “revolution of crime”, the concept and its meaning are not only applicable to some African states like the Democratic Republic of the Congo and Nigeria, but specifically also South Africa. GI-TOC’s reliable Global Organized Crime Index (2023) places South Africa seventh in the world in terms of general and organised crime, in the company of Venezuela, Afghanistan and El Salvador. This perspective is further confirmed by the prevalence of numerous scandals, including the arms deal scandal, Oilgate, Travelgate and many more, as supported by the findings of the Zondo Commission of Enquiry. The report indicates extensive forms of endemic and systemic corruption – also known as state capture. As a state South Africa also reflects the characteristics and features associated with criminal states. This has recently been further confirmed by the judgments of lieutenant-general Mkhwanazi, who has implied corruption at the highest level in the South African Police Services (SAPS), and which caused the minister concerned, Senzo Mchunu, to be placed on compulsory leave pending specific investigations.

The aim of this research is not only to determine whether South Africa qualifies to be identified as a criminal state, but it is also an analysis and assessment of this phenomenon in South African politics. The creation of a normative framework regarding the state (features, characteristics, functions and tasks) will be used as a basis to identify the distinguishing nature of criminal states, in other words what makes this category distinctive, and also different according to characteristics earlier associated with states. Unlike my previous research on the classification of South Africa within the category of criminal states (pakhanate), this article is focused on a broader application of the criminal state context. The focus is especially on the functioning (nature and effect) of criminal tendencies within the South African political dispensation and the implications thereof for the democratic political dispensation. The investigation is in the form of a literature study, of a qualitative nature, deductive (functioning from a specific analytical framework), while verification is of a qualitative nature (normative) by means of the use of data, numbers and information that will serve as motivation and evidence. Focal points of the research include:

Keywords: cadre deployment; construction mafia; criminal state; mafia state; nation state; pakhanate; political assassinations; state capture; weak/failed state; Zondo Commission of Enquiry

Volgens GI-TOC se Global Organized Crime Index (2023) val Suid-Afrika saam met state soos Venezuela, Afganistan, Honduras, Trinidad en Tobago, El Salvador, Brasilië en Jamaika in die kategorie van state waar misdaad die meeste ter wêreld voorkom (Swanepoel 2024:1). Met ’n puntetoekenning van 7,18 word Suid-Afrika volgens hierdie indeks sewende in die wêreld geplaas. Hoewel misdaadsyfers soms afwaarts beweeg (afhangende van omstandighede, optrede ens.), bly die Suid-Afrikaanse syfers steeds onaanvaarbaar hoog. Die totale aantal moorde en gepoogde moorde van 2020 tot 2022 (drie jaar) was 154 896, en die getal moorde tydens 2022 alleen 24 216 (Swanepoel 2024:2; CRA 2024). 3

Hoewel gewone misdaad ernstig is, is aanvullend hiertoe die hoë vlakke van georganiseerde misdaad in Suid-Afrika (soos uitgewys deur die reeds genoemde GI-TOC Crime Index, wat uiters problematies is. Hiervolgens bevind Suid-Afrika hom ook sewende in die wêreld (net onder Nigerië en die DRK), wat as uiters kommerwekkend beskryf kan word. 4 ’n Spesifiek onderskeidende kenmerk van misdaadstate, naamlik ’n verhouding tussen georganiseerde misdaad en die politieke regime (regering, staats- en semistaatsinstellings, politieke leiers asook staatsamptenare), is boonop deur onder meer die Zondo-kommissie van Ondersoek 5 asook talle ander kommissies van ondersoek uitgewys. Die omvang van geïnstitusionaliseerde korrupsie het binne die Suid-Afrikaanse konteks as staatskaping bekend geraak.

In ’n internasionale politieke omgewing waar sommige state hul magsbasisse ten koste van ander rolspelers verloor (sommige met ’n misdaadgrondslag), groot internasionale herposisionering wat tans aan die orde is, asook verswakkende-staat-tendense, skep dit ’n omgewing wat bevorderlik is vir misdadige sindikate en ander georganiseerde misdaad wat oor staatsgrense heen strek. Verder is daar histories bewys dat state waar ’n samehang en/of samewerking tussen misdadige en politieke elite bestaan, geensins uitsonderlik is in ’n wêreld waar misdadigheid wêreldwyd besig is om te eskaleer nie. Naim (2012:2–6) verwys na “a revolution of crime”, wat talle state wêreldwyd impliseer, onder meer Italië en Japan as klassieke voorbeelde, met meer onlangse voorbeelde Colombia, Bulgarye, Sirië, Montenegro, Venezuela en Transnistria.

Met bogenoemde as kontekstuele bevestiging dat Suid-Afrika wel binne die kategorie van misdaadstate val (vergelyk ook Labuschagne 2023 en Duvenhage 2024:487–513), is hierdie artikel toegespits op navorsing oor die aard en werking van die Suid-Afrikaanse misdaadstaat. 6 Daar sal in die besonder gelet word op die implikasies van die misdaadstaatkonteks vir die groter politieke bestel in Suid-Afrika in die algemeen, en meer bepaald wat dit vir Suid-Afrika se konstitusionele demokrasie beteken. 7 ’n Meer uitgebreide en gedetailleerde toepassing van die misdaadstaatbegrip op Suid-Afrikaanse toestande is derhalwe hier ter sprake. Die misdaadstaatpraktyk in Suid-Afrika sal verder ook aan kritiese beoordeling onderwerp word. Die ondersoek is oorsigtelik en verkennend van aard, nasionaal toegespits en nie internasionaal nie, en gebruik dieselfde sentrale konseptuele raamwerk soos in vorige navorsing gebruik is, waarbinne ’n toepassing op die hedendaagse Suid-Afrikaanse konteks gemaak sal word. Die ondersoek is ’n literatuurstudie, deduktief-verkennend van aard, en sal data en bronne (oorwegend kwalitatief) gebruik as grondslag vir motivering en verifiëring van standpunte en argumente.

Ten einde bogenoemde doelstelling te bereik, moet die volgende uitgeklaar word:

2. Die staat: ’n konseptualisering en operasionalisering

Die politieke omgewing, onderskei van ander omgewings (ekonomies, maatskaplik, geografies, tegnologies, ens.), plaas die primêre fokus op mag, die institusionalisering hiervan en die wyses waarop mag binne samelewingsverbande aangewend en toegepas word. MacIver (1966:4–5) wys daarop dat “the state exists within society, but is not even a form of society”. Histories het die staat verskeie vorme aangeneem, waaronder stadstate, kerkstate (die Middeleeuse nomokrasie), groot ryke (waaronder die Romeinse Imperium en andere). Sedert veral 1648 (met die Vrede van Wesfale) het die staat as dominante struktuur na vore getree, waarin politieke mag struktureel gesetel en uitgeoefen is (Du Plessis 1941; Duvenhage 1998:1–35). Generies het al bogenoemde vorme van staat dit gemeen dat hulle mag op bepaalde wyses geïnstitusionaliseer word en dat waardes en skaars middele daarvolgens gesaghebbend toegewys word. Politiek beteken hiervolgens die vermoë om steun te organiseer en te mobiliseer binne ’n bepaalde samelewingsverband (of onderdeel daarvan), met as doel die verkryging en/of konsolidasie van ’n magsbasis (institusioneel gefundeer) waardeur bindende besluite (toedeling van waardes en skaars middele) met betrekking tot die samelewing of dele van die samelewing kan plaasvind, en wat mededingende of vyandige magsbasisse vreedsaam of nievreedsaam kan inhibeer (en selfs verhoed) om hul besluite of waardes op die samelewing of dele van die samelewing af te dwing. 8

Sedert 1648 het die staat -begrip geleidelik wêreldwyd inslag begin vind, met die postkoloniale omgewing na 1945 wat grootliks uit state bestaan het, met die veronderstelde monopolie oor die staatsmag (Heywood 2002:121–2). 9 ’n Oorheersende beskouing oor die staat binne die literatuur is die Weberiaanse beskouing (1964:154, 156), ’n magstaatsbeskouing waarvolgens die staat voorgehou word as

an organization composed of numerous agencies led and coordinated by the state’s leadership (executive authority) that has the ability to make binding rules for all the people as well as the parameters of rulemaking for other social organizations in a given territory, using force if necessary to have its way. 10

Die kernkenmerke van ’n staat het ingesluit ’n vaste geografiese territorium; ’n burgery met regte, vryhede en verpligtinge wat verskil van een bestel tot die ander; ’n permanente owerheid (regime waarvan die regering ’n onderdeel vorm) wat bindende en afdwingbare besluite kan neem en implementeer, en ook as instelling op soewereiniteit kan aanspraak maak (Heywood 2002:85–88).

Die inkleding van ’n staatkundige bestel (hoe die politieke orde ingerig word oftewel die inrigting van die “regime” of politieke stelsel) kan nietemin fundamenteel van bedeling tot bedeling verskil, en breedweg kan daar onderskei word tussen demokratiese en niedemokratiese bedelings – beide met verskeie sub- of onderskeidende kategorieë. 11 Met konstitusionele demokrasie as normatiewe uitgangspunt tot hierdie ondersoek word sake soos beperkte regering , skeiding van staatsmagte , verantwoordelike en aanspreeklike regering , die oppergesag van die reg , konstitusionalisme , erkenning van burgerregte en -vryhede , en gereelde en vrye verkiesings as belangrike en rigtinggewende kenmerke (ook normatiewe kriteria) uitgesonder. (Kyk Stern 1984 se kenmerke soos geassosieer met regstate in hierdie verband.) Dit is belangrik om reeds hier te vermeld dat bogenoemde kenmerke van regstate baie duidelik in die Suid-Afrikaanse Grondwet van 1996 vervat word.

Vir die doel van hierdie ondersoek word die normatiewe grondslag bepaal deur ’n verbintenis tot reg en ’n regverdige samelewing; die bestaan van ’n regeerkundige oorsigfunksie, ondersteun deur ’n oppermagtige grondwet met afdwingbare bevoegdheid; geen landswet wat die oppermagtigheid van die grondwet in enige opsig aantas nie en ’n verbintenis tot die uitbouing van sodanige raamwerk; en ’n burgery wat die oppermag van die grondwet asook die afdwingbaarheid daarvan erken (Malan 2019:7–17). In wese moet die staat ’n openbare regsorde in algemene belang in stand hou, toegespits op die bevordering van die “common good”.

In samehang met bogenoemde normatiewe regstaatlikheid is die beklemtoning van sake soos effektiwiteit, funksionaliteit en norme wat hieruit voortspruit (soos doelgedrewenheid, volhoubaarheid, dienslewering ens.) ten minste net so belangrik as eersgenoemde. Huntington (1968:1–8) het destyds reeds verklaar dat “degree of government” (verwysend na funksionele regering) selfs belangriker is as “form of government” (demokraties versus niedemokraties) en daarom meer diepliggende toeligting verdien.

Die totstandkoming van state tydens die 19de eeu en vroeër in veral Wes-Europa het gegroei uit nasionale identiteite as grondslag teen die agtergrond van groot oorloë wat oor eeue heen in Wes-Europa geveg is. Effektiwiteit, funksionaliteit en wat hiermee saamgaan, het via die militêre omgewing telkens ’n rol gespeel in die totstandkoming van state in veral Wes-Europa. Tydens die 20ste eeu, soos vroeër aangedui, het die getal state dramaties vermeerder – ’n proses wat tot vandag steeds voortduur. Historiese prosesse, waaronder kolonisering en later dekolonisering, het ’n rol gespeel in die totstandkoming van “nuwe state”. Nuwe state het meestal in die afwesigheid van daardie faktore/determinante vir staatvorming soos wat dit histories binne ’n Wes-Europese konteks bestaan het, beslag gekry. Die resultaat was mislukte state of wat soms as “failed states” beskryf is en wat in ’n funksionele opsig geensins voldoen aan die Weberiaanse beskouing van staat soos vroeër aangedui nie. 12 In teenstelling met Weberiaanse sterk state het verswakkende state die volgende kenmerke:

(Kyk Zartman 1995; Migdal 1988; Rotberg 2022:85–96; Jackson 1993; Geldenhuys 1999 en Mazrui 1995:28–34.)

Drie kategorieë van staatsverswakking kan geïdentifiseer word, te wete sagte state (korrupsie en grensbeheer is problematies); swak state (die voorgaande, maar verder ’n onvermoë om kernverpligtinge te volvoer); en mislukte (“failed”) state , wat benewens al bogenoemde omstandighede boonop oor ’n gebroke soewereiniteit beskik (Duvenhage 2024b:491–2). Laasgenoemde impliseer dat ’n vyandige magsbasis beheer geneem het oor ’n gedeelte van die staatsterritorium, soos byvoorbeeld in die DRK en Somalië. Die uiterste vorm van staatsverswakking word soos volg deur Zartman (1995:1) beskryf: “a situation where the structure, authority (legitimate power), law and political power have fallen apart and must be reconstituted in some form old or new; for a period, the state itself, as a legitimate functioning order is gone”.

Hierdie ondersoek neem as uitgangspunt en normatiewe grondslag vir die beoordeling van die staat (en verwante praktyke) die kriteria verbonde aan ’n konstitusionele staat ( regstaat ) en aanvullend hiertoe die funksionerende staat , ontleen aan die Weberiaanse beskouing van staat . Sentraal is die beskouing dat die staat ’n openbare regsorde in algemene belang volhoubaar moet kan handhaaf.

Met bogenoemde as sentrale uitganspunt word die onderskeidende aard van misdaadstate nou geïdentifiseer voordat die Suid-Afrikaanse toepassing daarvan gemaak sal word.

3. Misdaadstate – ’n konseptualisering

Misdaadstate of state wat met misdaad geassosieer word (of dit ooglopend toelaat) is allermins ’n nuwe verskynsel. Dit kom wêreldwyd voor, hoewel state verskil ten opsigte van die graad hiervan asook die wyses waarop die interaksie tussen politieke en kriminele elites gereguleer en soms geïnstitusionaliseer word (Naim 2012; Patrick 2012:1–8; Alfano 2015:1–12; Duvenhage 2024b:487–513). Hierna kan ook as die verhouding tussen misdadigheid (veral aan die kant van misdadige elites) en die staat (politieke elites, inbegrepe funksionarisse in die politieke stelsel) verwys word. Verskeie begrippe word in hierdie verband gebruik, waaronder mafiastate (Naim; Patrick; Alfano), pakhanate 13 (Duvenhage) en predatorstate (Robinson). Patrick (2012:1–8) waarsku egter dat die begrip mafiastaat die gevaar loop “[to] oversimplify a broad spectrum of criminal-state relationships”. Inderdaad is hierdie verhoudinge gekompliseerd en verskil dit van staat tot staat en van omgewing tot omgewing. Die begrip misdaadstaat is soortgelyk in inhoud aan bogenoemde en word vir die doel van hierdie ondersoek gebruik om na hierdie kategorie van state te verwys.

Misdaadstate en/of state wat met misdadige optrede geassosieer word, is histories oud en gevestig, maar was telkens eiesoortig betreffende dit wat vroeër as “criminal-state relationships” beskryf is. Klassieke voorbeelde van waar georganiseerde misdaad beduidend op die politieke omgewing ingewerk het, sluit in Italië (Mafia-strukture), Japan (Yakuza) en Rusland (Bratva). 14 Ander state wat hedendaags as misdaadstate beskryf kan word, sluit in Venezuela, Sirië (tydens die Assad-dinastie) en Montenegro. 15

In die hedendaagse wêreld is daar verskeie faktore wat bydra tot die groei en ontwikkeling van misdaadstate:

Misdaadstate word gevolglik geassosieer met samewerking met, of selfs ’n samehang van misdadige en politieke elite binne ’n bepaalde staat of andersoortige verwysing (ook internasionaal of transnasionaal). Sodanige state se strukture is verswak (veral, maar nie uitsluitlik nie, die strafregstelsel). Demokratiese praktyke (soos beperkte en verantwoordbare regering asook die oppergesag van die reg), is afwesig of word, indien wel, selektief toegepas; en die algemene belang van die burgery word versaak ten gunste van die belang van ’n misdadig georiënteerde politieke elite. Die praktyk soos hier aangedui, verskil wesenlik van wat vroeër as die normatief-funksionele grondslag van die ideale staat voorgehou is.

Die praktyk van staatskaping word direk met die konteks van misdaadstate geassosieer soos dit hier bo uiteengesit is. Staatskaping verwys na ’n sistemiese vorm van politieke korrupsie waarin private belange die besluitnemingsprosesse van die staat manipuleer tot die voordeel van politieke en/of regime-rolspelers enersyds en private belange andersyds (Patterson 2023:1–4; Duane 2017; Duvenhage 2021:713–37 en 2024b:504–9). 18

Mafia-agtige netwerke word polities en institusioneel gevestig, wat soms van die hoogste politieke vlak tot op voetsoolvlak strek met pogings om die strafregstelsel en substelsels (polisie, howe, korrektiewe dienste) te manipuleer ten einde eersgenoemde netwerke nie verantwoordelik en aanspreeklik te hou nie. Patterson (2023:2) verwys na pogings om die “verantwoordbare ekosisteem”, inbegrepe die geregtelike gesag, oorsiginstellings, die burgerlike samelewing en die media te manipuleer. Waar staatskaping aanwesig is, word demokratiese praktyke verontagsaam, funksionaliteit en dienslewering ingeboet en word daar nie in algemene belang gehandel nie. Heel dikwels is dit die arm en gemarginaliseerde groepe wat die meeste onder staatskaping ly (Patterson 2023:3–4).

Uit die voorgaande is dit duidelik dat misdaadstate histories gesproke ’n bekende verskynsel is wat oor bepaalde en spesifieke kenmerke beskik, onderskeidend van wat as die algemene norm vir state gestel word, en waarin die samewerking tussen politieke en misdadige elites (’n belangrike onderskeidende kenmerk) meestal ten koste van die algemene belang van die burgery meewerk.

Met bostaande as ontledings- en konseptuele raamwerk en uitgangspunt kan daar nou op die Suid-Afrikaanse konteks gefokus word.

4. Die Suid-Afrikaanse staatkundige bestel

Die Suid-Afrikaanse staat kan as ’n verswakkende staat beskryf word soos gemeet aan die kriteria afgelei vanuit die Weberiaanse staatsbeskouing, soos vroeër verduidelik (Greffrath 2015). Eunomix, ’n politieke en ekonomiese-risiko-ontledingsgroep, het vyf jaar gelede voorspel dat Suid-Afrika teen 2030 ’n volledig mislukte staat gaan wees indien daar nie ’n drastiese ingryping en koersverandering plaasvind nie. 19 Kenmerke geassosieer met verswakkende state sluit in: beperkte outonomie/soewereiniteit; wanfunksionele regime-eienskappe; ’n onvermoë om ’n raamwerk vir ontwikkeling en groei daar te stel; en die nienakoming van goeie regeerkundige en bestuurspraktyke. Bogenoemde kom redelik algemeen in Suid-Afrika voor (vergelyk Greffrath 2015; Businesstech 2025:1–4; Eunomix 2020; Duvenhage 2023d:1–32). Verswakkende regime-eienskappe word weerspieël in onder meer die verval van plaaslike regering en ander sfere van regering; ’n onvermoë om grense te beveilig, soos weerspieël deur die groot aantal onwettige immigrante in Suid-Afrika; die verval van die strafregstelsel en eskalerende misdaad; en die inploffing van semistaatsinstellings soos Eskom, Transnet, die Poskantoor en die Landbank. Algemene politieke en institusionele verval is kenmerkend van die groter staatkundige bestel in Suid-Afrika. 20 Dit moet nietemin beklemtoon word dat komponente van die regime, inbegrepe semistaats- en niestaatsektore (die Reserwebank, Tesourie en bankstelsel; die SAID; privaat veiligheidsinstellings en diensleweringsgeoriënteerde instellings, telkens buite die staat of semi-outonoom) die funksionaliteit en veerkragtigheid van die status quo help verseker. Binne die formele staatsektor is agteruitgang nietemin op talle vlakke te bespeur.

Hoewel grondwetlik demokraties, bevat die groter politieke stelsel (regime) kenmerke wat nie met demokratiese ordes, veral gevestigde demokrasieë, geassosieer kan word nie. Hieronder tel sake soos staatsverswakking (hier bo genoem); eenpartydominansie wat oor drie dekades strek; 21 ’n oorheersende regering wat regimetendense openbaar; ’n transformatiewe raamwerk wat diskriminerend is (vergelyk IRR 2025b), asook die oorregulering van nie net die politieke omgewing nie, maar ook die ekonomie en burgerlike samelewing. ’n Duidelike sosialisties-sentralistiese tendens is ook waarneembaar binne die raamwerk van transformasie, 22 asook eskalerende polities-staatkundige, ekonomiese en maatskaplike uitdagings.

Ekonomiese uitdagings het te make met gebrekkige ekonomiese groei oor die afgelope dekade en beperkte groeigeleenthede vorentoe; ’n krimpende belastingbasis vir steeds groter maatskaplike en welsynsprojekte, waaronder groeiende maatskaplike toelaes en nasionale gesondheidsversekering soos in die vooruitsig gestel; swartbemagtigingsvereistes afkomstig vanuit die breë transformatiewe ideologie; patrone van deïndustrialisering; radikale en populistiese wetgewing, waaronder die omstrede Bela-wet oor onderwys en wetgewing oor onteiening sonder vergoeding as die bekendste voorbeelde; eskalerende buitelandse skuld; en ’n internasionale omgewing onder die leiding van die VSA en Donald Trump met ’n kritiese ingesteldheid ten opsigte van Suid-Afrikaanse beleid en praktyk. 23

Maatskaplike toestande word gedefinieer deur patrone van politieke en maatskaplike onstabiliteit; een van die grootste gapings tussen ryk en arm ter wêreld; en hoë vlakke van armoede (Duvenhage 2023d:22–3; ICTJ 2022). Sowat 13,8 miljoen mense (uit ’n bevolking van meer as 60 miljoen) leef in armoede. (Die April 2021-maatstaf vir armoede is ’n inkomste van minder as R133 500 per jaar, met bykans ’n derde van die bevolking (sowat 18 miljoen) wat maatskaplike toelaes ontvang – ’n syfer wat sedertdien verder gestyg het (Statista 2022:1–4). 24

