"title","author","text","edition","language_code","source_type","__index_level_0__"
Hulle is onderwysers in opleiding … hulle moet hul kommentaar en enige persoonlike opinie wat hulle oor die skool het, vir hulself hou … hoe hulle hulself moet gedra ... professionele gedrag. (POK A3.2)

Pedagogiese en onderrigomstandighede, die gebruik van verskillende leerstyle … Berei u betyds voor en het u al die nodige hulpmiddele tot u beskikking? Maak u van bykomende bronne gebruik? Daar moet in ag geneem word dat dit deesdae veral gaan oor die integrasie van tegnologie in onderrig. Hoe bestuur u dus u klaskameromgewing en hoe handhaaf u orde tydens onderrig? (TPC H1)

Die mentoronderwyser moet interaksie met die student hê, wat basies ’n mentorskaprol is. Leiding, die verskaffing van inligting oor loopbaankeuses, jy weet, spesifieke aktiwiteite om die student te help. (POK A3.2)

Daar is geen beleidsdokument wat riglyne aan die onderwysstudente gee oor hoe om voorvalle aan te meld nie. Dieselfde geld vir skole, dat hulle kan weet hoe om voorvalle aan te meld. (POK A4)

… ten minste ’n begrip, of dit nou ’n memorandum van verstandhouding tussen die universiteit en die skool is, wat die mentoronderwyser kanaliseer na die onderwysstudent, en ’n soort riglyn van die verwagte gedrag, en dit is vir my so ver as wat ons kan gaan, want dit is so kontekstueel, en wissel van geval tot geval. (POK A3.3)

Kleredrag, persoonlike voorkoms, en gesagsverhoudinge word reeds by universiteite se etiek- en gedragskodes ingesluit (Noordwes-Universiteit 2019a:16; Deakin University School of Education 2025).

Nog ’n aspek om in ag te neem, is dat etiekbeleide en -riglyne in vennootskap met rolspelers in praktiese onderwys opgestel behoort te word (PrimTEd 2019). POK’s het voorgestel dat SARO en rolspelers wat direk by praktiese onderwys betrokke is, soos die Departement van Basiese Onderwys (DBO) en Provinsiale Onderwysdepartemente, betrokke by die opstel van hierdie beleide moet wees.

Eintlik verwag SARO hulle moet van hul eerste studiejaar af registreer, want onthou, hulle gaan van die eerste jaar af op praktiese onderwys. (POK H1)

Basies is dit gewoonlik gefokus op die vierde jaar, so dit is nie regtig gefokus op die eerste jaar nie, so dit is die fokus op hierdie stadium. Dit is die vierdejaarstudente om hulle te laat registreer ... iemand wat inkom wat spesifiek praat oor registrasie vir SARO. (POK A3.2)

Ons as ’n universiteit kan dit nie monitor nie. Studente doen dit op hul eie, onthou en hulle het die aansoek na SARO gestuur, en die aansoek is aanlyn. So, ons weet nie of studente geregistreer het of nie. Miskien moet ons met ’n moniteringstelsel vorendag kom om te kyk of studente geregistreer het, maar terselfdertyd, omdat dit ’n nuwe ding is, het SARO nog nie eers oor enigiets gekla nie. (POK H1)

SARO, as professionele raad vir onderwysers in Suid-Afrika, behoort een van die hoofrolspelers te wees wanneer beleide vir etiek in praktiese onderwys opgestel word. Dit blyk dat die onderskeie universiteite tans verskillende verwagtinge van hulle studente het in terme van wanneer hulle by SARO moet registreer. Dit blyk ook uit POK H1 se antwoord dat voorwaardelike registrasie van eerstejaaronderwysstudente ’n onlangse verwikkeling is. Daar is ook onsekerheid oor óf en hóé SARO gaan optree indien etiese dilemmas tydens praktiese onderwys voorkom.

Volgens die POK’s behoort die DBO egter ook betrokke te wees by die praktiese onderwysvennootskap.

So, ons vennootskappe moet dwarsoor skole wees, jy weet, ons studente, ons regering. Vir my, sou ek sê ons regering moet in staat wees om te sê ons sal ons studente ’n toelaag gee. (POK H1)

Dit sal help as daar ’n enkele dokument is, om te verhoed dat studente soos buitestanders voel wanneer onderwysstudente van ander universiteite by die skool is waar hulle hul praktiese onderwys doen. Dit sal help, want aan die einde van die dag sal hulle almal vir dieselfde onderwysdepartement werk, so dit behoort nou eenvormig te word. (POK A4)

POK’S meen dat die DBO se betrokkenheid kan beteken dat daar ’n duidelike, gesamentlike beleid vir praktiese onderwys is wat deur alle universiteite en skole gevolg word. Een voordeel hiervan is dat almal oor dieselfde kam geskeer sal word tydens praktiese onderwys, ongeag by watter universiteit die onderwysstudent studeer. Nog ’n voordeel is dat die DBO dan reeds voornemende onderwysers oplei in terme van wat van hulle verwag gaan word as onderwysers in Suid-Afrika.

Figuur 5. Tema 4: etiekopleiding

Uiteindelik is dit belangrik om die verskeie partye wat by praktiese onderwys betrokke is, op te lei rakende die verwagtinge van etiek in praktiese onderwys. Etiekopleiding kan in twee dele opgedeel word: onderwysstudente se etiekopleiding en mentoronderwysers se etiekopleiding. Figuur 5 dui aan wat etiekopleiding behoort in te sluit na aanleiding van die temas in hierdie navorsing. Onderwysstudente se opleiding behoort pedagogiek en didaktiek van hul bepaalde fase, etiekteorieë, gevallestudies oor etiese dilemmas en voorbereiding voor praktiese onderwys, in te sluit. Ouers en versorgers stuur hul kinders skool toe sodat die onderwysers hulle kan onderrig. Dus kan dit as oneties beskou word indien onderwysers nie weet hoe om leerders te onderrig nie, of die verkeerde vakinhoud oordra (Woody 2008).

So, daar is die inhoudelike roete wat ons volg en byvoorbeeld oor jaar een, afhangende van wat die fokuspunte in die jaargroep is, sou ons fokus op die pedagogie van praktyk. (POK A3.3)

Dit blyk dat die universiteite wel kursusinhoud insluit in terme van wat ’n etiese onderwyser is. Sommige POK’s kon egter nie hierop uitbrei nie, aangesien die inhoud deur die lektore bepaal word.

Ons spreek die rolle, regte en verantwoordelikhede aan. Regsverantwoordelikhede en die wetlike regte, byvoorbeeld, van die onderwyser. Dit word dus breedweg gedek as deel van die soort professionele ontwikkelingspraktykfokuspunte. (POK A3.3)

Verder het POK’s aangedui dat dit nodig is om onderwysstudente bewus te maak van etiekbeleide wat hulle moet gehoorsaam, byvoorbeeld die SARO Professionele Etiekkode. Sommige POK’s het ook aangedui dat SARO betrokke is by hul universiteite om ’n lesing aan die finalejaar-onderwysstudente te gee oor die verwagtinge van SARO.

... in die vierde jaar, dit is die laaste jaar van ons program, praat ons oor die belangrikheid daarvan om te verstaan wat gesê word in, byvoorbeeld, die SARO-dokument. Ons spandeer tyd om te kyk na daardie nasionale soort beleidsriglyne wat daar is rondom etiek- en gedragskodes, en dan word dit afwaarts na die universiteit gekanaliseer, gedragskode en dan ook afwaarts na binne ons praktiese onderwys gedragskode. So, daar is die breër makro dat hulle verstaan dat jy deel is van hierdie beroep en die etiese riglyne kom van SARO. (POK A3.3)

Dit is interessant om daarop te let dat geen van die POK’s genoem het dat onderwysstudente opgelei word in terme van etiekbeleide vir die Fakulteit Opvoedkunde of praktiese onderwys nie. Dit is moontlik omdat nie een van hierdie universiteite blyk om offisiële etiekbeleide te hê nie of weens die gaping tussen die praktiese onderwys-administrasiekantoor en die lesingsaal.

Benewens bewusmaking van etiekbeleide, is gevallestudies aanbeveel om onderwysstudente in terme van etiek op te lei. Die veronderstelling is dat onderwysstudente nie bloot bewus moet wees van beleide nie, maar ook moet oefen om eties te redeneer en die etiekbeleide toe te pas. Hierdie praktyk word ondersteun deur verskeie vorige navorsers (Boon 2011; Goh en Matthews 2011; Bergman 2013; Kumar 2015), asook deur onderwysstudente self (Kriel e.a. 2021:594).

... gevallestudiescenario’s, dit is ’n spesifieke konteks wat vir hulle gestel word, en hulle sal ’n analise hiervan moet doen. So, wat is die eintlike kwessie hier? Wat is die rol van die onderwyser? Gaan dit verder as die verwagtinge van die onderwyser en moet ondersteuningsdienste of ’n skoolberader ingeroep word, of moet iemand meer senior die saak hanteer? So, daar is leer deur te doen. Want onthou ons is in praktiese leer, so vir ons gaan dit baie oor hoe dit in die praktyk gelyk het en wat doen jy dan binne die perke van jou rolle, regte en verantwoordelikhede? (POK A3.3)

Om onderwysstudente vir praktiese onderwys voor te berei deur oriëntering ten opsigte van praktiese onderwys dokumentasie te doen, blyk ’n standaardpraktyk te wees by universiteite. Dit word gevind in vorige navorsing (Anangisye 2011; Ulla 2016), sowel as in die huidige studie.

Hulle word van oriënteringsmateriaal voorsien. (POK A3.2)

Daar is ’n brief sodat almal op dieselfde bladsy moet wees, hulle verstaan ​​elkeen se rol. (POK H1)

Dit word dus duidelik dat die bewusmaking van mentoronderwysers oor wat van die verskeie rolspelers in praktiese onderwys verwag word, net so belangrik is. Dit word ook in die Suid-Afrikaanse programakkreditasie vir hoër onderwys bevestig (Hoër Onderwyskwaliteitskomitee 2004). Mentoronderwysers se etiekopleiding behoort ’n kortkursus of ten minste ’n mentorgids in te sluit sodat mentoronderwysers weet wat van hulle verwag word in terme van mentorskap, sowel as persoonlike en professionele gedrag.

Ons kurrikulum het nie ’n mentorskapkurrikulum gehad nie. En selfs tot nou toe het ons kurrikulum nie ’n mentorskapkurrikulum nie ... moet vir ten minste twee of drie jaar onderrig gee. Maar dan na twee of drie jaar moet ons ’n mentorskapprogram hê ... Sommige van hulle werk op die ervaring van wat die mentoronderwyser gedoen het toe hulle ’n onderwysstudent was. Maar nou moet ons hulle riglyne gee. So as die DOB dit nie self doen nie, kan hulle vir universiteite sê: “Ons gee julle hierdie bedrag geld om ons mentoronderwysers op te lei.” (POK H1)

Jy motiveer die mentoronderwysers om hierdie opleidings by te woon deur die CPD-punte toe te ken. (POK A4)

En as jy nie die opleiding kan bywoon nie, moet jy ten minste ’n mentorgids kry voordat die studente by die skool aankom om deur die dokument te werk ingeval jy enige vrae het (POK A4, 14.365–8). Dus voel ek weereens dat ’n standaardmentorgids per fase baie voordelig sal wees. (POK A4)

POK’s stel voor dat die DBO en SARO by mentoronderwyser-opleiding betrokke raak deur dit te akkrediteer en punte vir voortgesette professionele onderwyserontwikkeling daarvoor toe te ken. Aanlyn opleiding kan gebruik word vir opleiding van onderwysers wat ver van die universiteit af woon om te verseker dat alle mentoronderwysers toegang tot die opleiding het. Die voordeel van aanlyn opleiding is ook dat die opname van die opleiding beskikbaar gemaak kan word aan mentoronderwysers wat nie die sessie kon bywoon nie. Beide in persoon en aanlyn opleidingsessies behoort egter ’n mentoronderwysergids te gebruik wat elke mentoronderwyser moet ontvang. ’n Laaste voorstel wat POK’s gemaak het is dat hierdie mentoronderwysergids en alle ander praktiese onderwysdokumentasie op ’n toeganklike aanlyn portaal geplaas word. Etiekopleiding is dus belangrik vir onderwysstudente sowel as mentoronderwysers.

4.5 Wat etiek- en gedragskodes vir onderwysstudente se praktiese onderwys behoort te omsluit

Hierdie kwalitatiewe data het bygedra tot die beantwoording van die vraag Watter persepsies van praktiese-onderwyskoördineerders kom na vore oor die etiek- en gedragskodes vir onderwysstudente se praktiese onderwys? Ter samevatting is POK’s van mening dat etiekbeleide en -dokumente vir praktiese onderwys verbeter kan word. POK’s meen dit sal goed wees as daar standaard dokumente vir verskeie universiteite kan wees omdat onderwysstudente van verskillende universiteite praktiese onderwys by dieselfde skole uitvoer. Hierdie etiekbeleide en -dokumente behoort die volgende in te sluit:

4.5.1 Riglyne vir mentoronderwysers en skoolpersoneel

Mentoronderwysers moet deeglike riglyne ontvang rakende wat van hulle verwag word. Dit sluit in dat hulle onderwysstudente nooit sonder toesig mag laat nie. Onderwysstudente moet gementor word en geleenthede gegun word om die mentoronderwyser te observeer. Mentoronderwysers moet die onderwysstudente lei om binne die konteks van die skool aan te pas en te onderrig, omdat dit soms nie in ooreenstemming is met die konteks waarin hulle self grootgeword en skoolgegaan het nie. Mentoronderwysers mag ook geen seksuele opmerkings oor of teenoor onderwysstudente maak nie. Nog ’n dilemma wat in mentoronderwyserriglyne aangespreek moet word is diskriminasie. Diskriminasie teenoor onderwysstudente is gerapporteer op grond van fisiese voorkoms, geloof en ras. Hierdie sensitiewe kwessies moet deur die rolspelers in praktiese onderwys aangespreek word om te verseker dat daar nie teenoor onderwysstudente gediskrimineer indien hulle persoonlike oortuigings en voorkoms verskil van wat binne die skool as “normaal” beskou word nie. Een POK het opgemerk dat persoonlike voorkoms, soos haarstyl of tatoeëermerke nie noodwendig ’n negatiewe invloed op die gehalte van daardie onderwysstudent se onderrig het nie.

4.5.2 Riglyne vir onderwysstudente

Die riglyne vir onderwysstudente behoort persoonlike gedrag, professionele optrede, en rapporteringsriglyne in te sluit. Persoonlike gedrag behels riglyne oor hoe onderwysstudente hulself moet voorstel, asook verwagte kleredrag, gedrag by die skool, bywoning, betrokkenheid, stiptelikheid en die gebruik van sosiale media. Vorige navorsing deur Rusznyak (2018:5) voeg nakoming van sperdatums en vermyding van diskriminasie en plagiaat by verwagtinge van onderwysstudente. Professionele optrede behoort aspekte soos die gebruik van verskillende onderrigstyle, lesvoorbereiding (Boon 2011), die gebruik van leermateriaal en tegnologie, asook klaskamerbestuur aan te spreek. Die onderwysstudente behoort aan te pas by die skool se kultuur van onderrig en leer, om nie die leerders te verwar nie. Hierdie riglyne moet ook verwagtinge van betrokkenheid by ander skoolverwante aktiwiteite, soos oueraande en sportdae, spesifiseer. Riglyne vir die handhawing van professionele verhoudings met skoolpersoneel, leerders, ouers en versorgers, behoort ook in hierdie afdeling aangespreek te word. Hierdie verhoudings behoort deur wedersydse respek gekenmerk te word. Geen seksuele opmerkings mag oor of teenoor skoolpersoneel en leerders gemaak word nie. Uiteindelik behoort riglyne vir onderwysstudente ook die POPI-wet in te sluit (Accessible Law 2019). Hierdie Wet op die Beskerming van Persoonlike Inligting (POPI), 2013 (Wet 4 van 2013) vereis dat die verantwoordelike party (skool) geen inligting, insluitend akademiese prestasie en inligting aangaande dissiplinêre verhoor van die datapersoon (onderwysstudent), mag deel nie (Accessible Law 2019). Dus mag onderwysstudente se ouers nie die skool kontak of betrokke raak by enige rapporterings nie.

4.5.3 Riglyne vir rapportering

Dit is noodsaaklik dat etiek- en gedragskodes eksplisiet bepaal op watter wyse etiese dilemmas deur enige rolspeler in praktiese onderwys gerapporteer kan word. Skole behoort duidelike riglyne te ontvang oor hoe om onetiese gedrag van onderwysstudente aan te spreek en in watter situasies dit nodig is om hierdie gedrag by die universiteit aan te meld. Verder behoort onderwysstudente duidelike riglyne te kry wat hulle kan volg wanneer hulle ervaar dat daar oneties teenoor hulle opgetree word. Uit die aard van die saak is die verwagting dat die skool se praktiese-onderwyskoördineerder en/of die skoolhoof in sommige gevalle verantwoordelikheid sal neem om die situasie op te los. Dit is egter noodsaaklik om riglyne in plek te hê vir wanneer dit juis hierdie leiers is wat oneties optree, of indien die onderwysstudent te bang is om die situasie met die skool se leiers te bespreek. Hierdie riglyne behoort in geskrewe vorm in die praktiese onderwys dokumentasie ingesluit te wees. POK’s is van mening dat skole enige onetiese gevalle direk by die POK moet rapporteer wat dit dan verder sal verwys na die relevante persoon by die universiteit om die probleem aan te spreek. Braxton en Bayer (2004) het egter voorheen geredeneer dat besluite oor onetiese gedrag verkieslik deur ’n komitee aangespreek moet word, eerder as ’n individu. POK’s het ook die belangrikheid van geskrewe rapporteringsprosesse beklemtoon. Een POK het uitgewys dat sy alle gevalle wat telefonies aangemeld word hanteer, maar dat daar steeds versoek word dat ’n skriftelike e-pos so gou as moontlik gerig word. Deeglike rekordhouding van etiese dilemmas is noodsaaklik en ook in vorige navorsing (Braxton en Bayer 2004) bevestig.

4.5.4 Memorandum van verstandhouding

Die vestiging van ’n memorandum van verstandhouding kan help om die vennootskap tussen die universiteit en die skole te verbeter. Sommige universiteite het reeds met hierdie prosesse begin. Die memorandum moet verseker dat alle rolspelers van die etiekkode, gedragskode, rapporteringsriglyne, mentoronderwyser riglyne, onderwysstudentriglyne, asook enige ander praktiese onderwys dokumente wat die rolspelers se gedrag kan beïnvloed, bewus gemaak word.

Alhoewel die etiek- en gedragskodes as die derde tema geïdentifiseer is, vorm dit die belangrikste oorkoepelende tema, aangesien die etiek- en gedragskodes die ander aspekte – soos spesifieke etiese dilemmas, rapportering en opleiding in etiek – behoort te omvat en aan te spreek. Dit bevestig die noodsaaklikheid om die kwessie van beperkte beskikbaarheid van etiek- en gedragskodes aan te spreek, deur ontwikkeling en voortdurende opdatering van etiek- en gedragskodes. Onderwysstudente van verskillende universiteite voer praktiese onderwys by dieselfde skole uit. Dit sal goed wees as daar standaardriglyne vir etiek tydens praktiese onderwys vir die verskeie Suid-Afrikaanse universiteite kan wees. In die Suid-Afrikaanse konteks, behoort die standaard etiek- en gedragskodes vir praktiese onderwys SARO se ‘Professionaliteit en etiekkode’, asook die DBO se vereistes, aan te sluit by. So ’n gestandaardiseerde kode sal beteken almal word oor dieselfde kam geskeer, ongeag die universiteit waaraan hulle verbonde is. Dit kan help om verwarring te voorkom in terme van wat die verwagtinge van onderwysstudente, sowel as mentoronderwysers en ander skoolpersoneel, ten opsigte van etiese optrede tydens praktiese onderwys is. Gestandaardiseerde riglyne kan moontlik help om etiek in die onderwys oor die algemeen te verbeter omdat dit nie net deel van onderwysstudente se etiekopleiding vorm nie (Boon 2011; Alcòn 2017; Ulvik e.a. 2017), maar ook as riglyn vir onderwysers dien wat reeds in die beroep staan (Campbell 2000; Şahin e.a. 2009).

In lyn met deontologiese etiek, kan ’n gestandaardiseerde etiese raamwerk ’n rasionele standaard vestig waarna daar verwys kan word wanneer etiese dilemmas in praktiese onderwys opduik, maar wat ook as begeleiding vir voornemende, sowel as in diens onderwysers, kan dien. Daar behoort ’n etiek- en gedragskodes vir onderwysstudente, sowel as mentoronderwysers te wees wat spesifiek vir praktiese onderwys geskryf is. Daar moet verseker word dat die kodes ’n wye verskeidenheid kontekste, in ooreenstemming met Suid-Afrika se demografie, aanspreek. Vorige Suid-Afrikaanse navorsing het dieselfde aanbeveling gemaak (Orchard en Davids 2019). Gestandaardiseerde etiek- en gedragskodes kan die bestuur van etiese gedrag (of wangedrag) en behandeling van onderwysstudente tydens praktiese onderwys lei. Gegrond op deontologiese etiek (Johnson 2022) sal hierdie praktyk van gestandaardiseede riglyne, moontlik al die rolspelers wat by praktiese onderwys betrokke is aanmoedig om eties op te tree, omdat dit rasioneel-ontleedbaar is.

Na aanleiding van die etiese dilemmas wat aan POK’s gerapporteer word, behoort gedragskodes ontwikkel of opgedateer te word om die volgende afdelings in te sluit: persoonlike gedrag, professionele optrede (insluitend onderafdelings vir vakkennis en onderrigmetodes, verwagtinge ten opsigte van onderwysstudente se betrokkenheid by medekurrikulêre aktiwiteite, en etiese verhoudings met praktiese onderwys rolspelers), asook rapporteringsprosesse. Die etiekkode behoort ook melding te maak van die wette wat die verskeie rolspelers moet nakom, asook die norme wat van persone in die beroep verwag word.

’n Rasioneel-ontleedbare riglyn in lyn met deontologie (Johnson 2022) beklemtoon die belangrikheid van verskerpte kanale vir die rapportering van etiese dilemmas. ’n Suksesvolle gestandaardiseerde riglyn vir etiek in praktiese onderwys kan slegs suksesvol implementeerbaar wees indien verskeie rolspelers wel etiese dilemmas aanmeld, sodat dit deel van opgedateerde riglyne kan vorm. Om probleme rakende rapportering van etiese dilemmas uit te stryk, is dit noodsaaklik dat die gedragskode nie bloot noem dat rapportering moet plaasvind nie, maar riglyne vir hierdie proses voorsien. Dit blyk dat etiese dilemmas dikwels nie aangemeld word nie. Redes hiervoor het vrees en onkunde van die prosesse wat gevolg moet word ingesluit (Kriel e.a. 2021; SARO 2021b). Die aanbeveling vanuit hierdie studie is dat rapportering skriftelik en op ’n elektroniese platform behoort te geskied. Die vooruitsig is dat ’n aanlyn platform, waar etiese dilemmas maklik en konfidensieel deur individue gerapporteer kan word, rapportering sal aanmoedig en die vrees vir rapportering sal oorbrug. In die Suid-Afrikaanse konteks moet dit egter oorweeg word dat nie alle skole toegang sal hê tot ’n aanlyn platform vir rapportering nie. In hierdie gevalle moet die belangrikheid van skriftelike rapportering steeds beklemtoon word met die oog op rekordhouding. Om verwarring te voorkom by skole wat met onderwysstudente uit verskillende fases werk, is dit noodsaaklik dat die universiteit ’n standaard rapporteringsprosedure het wat deur almal gevolg word. Die rapporteringsriglyne behoort voorsiening vir verskeie situasies te maak, insluitend wanneer onderwysstudente oneties optree, wanneer leerders oneties optree, wanneer die mentoronderwyser oneties optree of wanneer die skool se leiers oneties optree. Terwyl die skoolhoofde dikwels etiese dilemmas tydens praktiese onderwys kan aanspreek en oplos, bly dit noodsaaklik dat die universiteit riglyne verskaf rakende watter tipe gevalle deur die skoolhoof aangespreek kan word. In ooreenstemming met ’n vorige studie (Braxton en Bayer 2004) is dit dikwels die beste om etiese dilemmas na ’n komitee te verwys om ’n finale besluit te maak.

Etiek- en gedragskodes moet gereeld opgedateer en hernu word soos praktiese onderwys verander en onderwysstudente onetiese situasies rapporteer. Dít sal verseker dat die kodes relevant bly en gebruik kan word om etiese dilemmas in verskeie kontekste aan te spreek. Die universiteite en skole moet sensitiewe kwessies soos seksuele wangedrag, diskriminasie op grond van voorkoms (insluitend kleredrag, haarstyl en tatoeëermerke), ras en geloof bespreek, om te verseker dat alle partye deur die riglyne in die etiek- en gedragskodes, asook memorandum van verstandhouding, beskerm word. Dit is noodsaaklik om hierdie kwessies te bespreek, sodat daar nie grys areas is rakende wat as aanvaarbaar en onaanvaarbaar in die onderwys beskou word nie. Terwyl individuele uitdrukking en religieuse kwessies deur basiese menseregteriglyne gelei word, is daar wel skole met hul eie gedragsraamwerke en -riglyne – in lyn met die skoolkultuur en professionaliteit – wat nie direk teenstrydig is met menseregte nie. Die ideaal is dat rolspelers soos universiteite se POK’s, DBO, DHO, SARO en skole se bestuur ooreenstem oor presies hoe om hierdie sensitiewe kwessies te hanteer en skriftelike riglyne daaromtrent by die etiekriglyne en -kodes vir praktiese onderwys insluit. Die riglyne behoort voorsiening te maak dat die POK’s kan intree om te bemiddel wanneer ’n student se regte geskend word, en indien nodig, die student te verskuif na ’n ander skool waar hul praktiese onderwys voltooi kan word. Verder kan hierdie riglyne moontlik prakties implementeerbare riglyne voorsien om sensitiewe kwessies sagkens aan te spreek, bv. ’n verwagting dat tatoeëermerke of haarstyle bedek moet word, en dat onderwysstudente (of onderwysers) genoegsame tyd gegun moet word om in en/of uit religieuse drag te verklee indien hulle dit nie tydens die skooldag mag dra nie.

Om suksesvolle implementering te verseker is dit belangrik dat hierdie etiek- en gedragskodes deur die Fakulteitsraad goedgekeur word en deel vorm van die universiteit se amptelike beleide (Braxton en Bayer 2004; Delgado-Alemany e.a. 2020). Indien die kodes informeel en slegs deel van die kursusinhoud is, word optrede deur die universiteit en ander rolspelers beperk wanneer een van die rolspelers oortree (Foulger e.a. 2009:1; Kumar 2015:61). Daarbenewens sal etiek- en gedragskodes egter geen impak hê indien die verskeie rolspelers wat by praktiese onderwys betrokke is, nie daarvan bewus is nie. Daarom word die aanbeveling gemaak dat die betrokke rolspelers opleiding oor die kodes moet ontvang, en dat Suid-Afrikaanse universiteite – in ooreenstemming met internasionale universiteite – die kodes moet onderteken (Walters e.a. 2017). Dit sal ook voordelig wees indien die DBO en SARO by die opleiding van onderwysstudente en mentoronderwysers betrokke kan raak. Verskeie deelnemers in hierdie studie is van mening dat mentoronderwyser-opleiding aangebied, of ten minste aanbeveel moet word deur die DBO en SARO, aan wie se gesag die onderwysers onderhewig is. Verder is dit ook aanbeveel dat mentoronderwyseropleiding aan voortgesette professionele ontwikkeling gekoppel moet word om onderwysers aan te moedig om dit by te woon.

