"title","author","text","edition","language_code","source_type","__index_level_0__"
In die vertaalopdrag word die doel van die vertaling uiteengesit, gepaard met ’n stel instruksies wat aan die vertaler gegee word (Nord 2002:111; Pym 2017:127). Indien die vertaalopdrag nie die vertaaldoel eksplisiet stel nie, is dit die vertaler se verantwoordelikheid om dit te bepaal, want die vertaler moet soveel moontlik inligting hê om ’n goeie-gehalte-vertaling te kan lewer (Nord 2018:122). Die vertaalopdrag behels die volgende inligting: teksfunksie, DT-lesers, tyd en plek wanneer dit ontvang word, die medium en die motivering (Munday, Pinto en Blakesley 2022:114).

In ’n studie oor die vertaalopdrag en ChatGPT wat deur He (2024) uitgevoer is, bestaan die basiese struktuur van die vertaalopdrag uit die opdrag self, die doel van die vertaling en die doeltaal. Dit moet ook die funksie van die vertaling in besonderhede beskryf; gevolglik moet dit ’n beskrywing van die DT-lesers, spesifikasie van die tyd en ontvangsplek van die teks, medium, en die vertaalmotief insluit. Dus is die funksionalistiese benadering belangrik as ’n teoretiese grondslag om ’n goeie vertaalopdrag aan ChatGPT-4o te verskaf.

Hierdie artikel lewer verslag oor ’n gevallestudie waarin Van den Bergh (2025) ’n diepgaande ondersoek na die vertaalgehalte van die KI-program ChatGPT-4o onderneem het. Voorts volg die studie ’n kwalitatiewe navorsingsontwerp met teksontleding as navorsingsmetode. Die data-insamelingsproses bestaan uit porboodskappe wat die vertaalopdrag, die BT én ChatGPT-4o se antwoorde daaroor bevat. Vervolgens word Nord (1997) se vier vertaaluitdagings gebruik om die data te ontleed en Pym (2016) se tipologie van vertaaloplossings gebruik om die data te bespreek.

Hancock en Algozinne (2006:10) omskryf ’n gevallestudie as navorsing oor ’n bepaalde geval wat dikwels mense, gebeurtenisse asook groepe behels, en dit gaan gepaard met intensiewe ontledings en beskrywings van ’n bepaalde eenheid of stelsel wat aan ’n spesifieke tyd en plek gebonde is. In die studie waaroor hierdie artikel verslag lewer, word ChatGPT-4o se vermoë om ’n tegniese teks te vertaal intensief ondersoek met die doel om die gehalte van die vertaling te ontleed en te beskryf.

Volgens Busetto, Wick en Gumbinger (2020:2) is die data wat deur kwalitatiewe studies ingesamel word, afkomstig uit geskrewe materiaal soos dokumente, en in die studie is die BT en DT’s die geskrewe materiaal ter sprake. Die BT, “Factor-mimicking portfolios for climate risk”, 4 is in Amerikaanse Engels geskryf. Dit is ’n formele, akademiese artikel omdat dit in die Financial Analyst Journal gepubliseer is en strukturele kenmerke van ’n akademiese artikel (soos ’n opsomming, inleiding, ontleding, resultate en gevolgtrekking) bevat. Volgens Schubert (2010:135) is ’n tegniese teks informatief, instruktief en beskrywend. Hierdie teks bied baie inligting oor klimaatsvriendelike portefeuljes (informatief) aan, en dit stel ’n reeks metodes voor om ’n portefeulje te optimaliseer en vektore te genereer ten einde ’n faktornabootsende portefeulje te konstrueer (instruktief). Voorts beskryf dit ook die inligting en verskynsels in die teks (beskrywend).

Kenmerkend van die funksionalistiese benadering is die vertaalopdrag wat vir ChatGPT-4o sal begelei om die twee vertalings uit te voer. ’n Vergelyking word getref tussen ChatGPT-4o se vertaling op die kundigelesersvlak teenoor ChatGPT-4o se vertaling op die lekelesersvlak. Hierdie vergelyking word deur middel van teksontleding as navorsingsmetode uitgevoer. Meer spesifiek is dit ’n inhoudelike ontledingsmetode wat in die studie onderneem word, omdat die inhoud van die BT en die DT’s aan die hand van Nord (1997) se vertaaluitdagings en Pym (2016) se tipologie van vertaaloplossings bestudeer word.

ChatGPT-4o 5 word as die KI-program vir die studie gebruik, omdat dit gewilder as ander is, die meeste gebruik word, en meer voorspelbaar as ander KI-programme is (He 2024:317). Tydens die uitvoer van die studie is ChatGPT 3.5 die gratis weergawe en ChatGPT-4o die betaalde weergawe, en ons het gekies om laasgenoemde weergawe te gebruik. Die rede vir dié keuse is dat dit toegang tot nuwe kenmerke bied en ook al die vorige ChatGPT-modelle insluit. Dus het die gebruiker toegang tot al die ChatGPT-modelle, alle gevorderde dataontledingstelsels en die oplaai van dokumente en webblaaie (OpenAI 2024). Die BT is gelaai met grafiese elemente en ChatGPT-4o beskik ook oor DALL·E se fotogeneratiewe stelsel, wat goed by die studie pas omdat die BT grafiese elemente soos grafieke en tabelle bevat.

Die data-insamelingsproses lyk so: Stap 1 is om vir ChatGPT-4o ’n Engelse porboodskap te stuur wat die vertaalopdrag en die BT in PDF-formaat bevat. Stap 2 is om die vertaalopdragte te hersien gebaseer op ChatGPT-4o se antwoorde daarop. Uit die vertalings wat ChatGPT-4o gelewer het, is die volledigste een vir ontleding gekies, wat die laaste stap in die data-insamelingsproses is.

Die vertaalopdrag vir die kundigelesersvlak behels die BT, aangeheg in PDF-formaat, gepaardgaande met die vertaalopdrag. Die vertaalopdrag vir die kundige leser lyk so:

Translate the attached source text, Factor Mimicking Portfolios for Climate Risk , into Afrikaans on an expert reading level. The Afrikaans expert-level reader of the target text is anyone in their final year of undergraduate studies and higher up. The expert will also be an expert in the following fields of study: Economics 6 and Climate risk. The translation will be published in the Financial Analyst Journal , thus it is of the utmost importance to adhere to the genre rules and stylistic features of the specialised text. This means that the layout of the attached source text should not be changed.

Dieselfde proses is vir die lekeleser gevolg, en met die eerste vertaalopdrag het ChatGPT-4o ’n kort opsomming eerder as ’n vertaling gebied. Vervolgens is die gekose vertaalopdrag soos volg gestel:

Translate the attached source text, Factor Mimicking Portfolios for Climate Risk , into Afrikaans on a lay reading level. The Afrikaans lay-level reader of the target text is anyone in grade 10 (NQF Level 2) and under. This means the lay reader does not understand all the terminology and formulas. The target text will be used in an economics class in grade 10, so the text should be adjusted so the lay reader can understand it. Please translate the whole document.

Vir ’n lekeleser is die gebruik van gewone taal ’n goeie vertaalstrategie om die inligting meer verstaanbaar te maak sonder om dit té informeel te laat klink. Volgens Schriver (1991:16) behels formulering in gewone taal die proses om komplekse tekssegmente te vereenvoudig, asook die organisering van die teks (sinne, paragrawe en die algehele ontwerp). Voorts meen Burger (2024:287) dat gewone taal die verstaanbaarheid van ’n teks verhoog. Dus is formulering in gewone taal ’n goeie strategie wanneer daar vir ’n leek vertaal word.

Die eerste skrywer het as kwalitatiewe navorser die vertaalkeuses beoordeel en het op grond van bronne die voorkeuropsie tussen die twee vlakke vasgestel. Ons is nie kundiges in die finansiële of klimaatveranderingsveld nie en het op navorsingsbronne wat in die openbare domein beskikbaar is, gesteun om ons besluite te motiveer. ’n Beperking van die studie is dus die moontlikheid van subjektiwiteit, en dit sou voordelig wees om ’n kundige te betrek. Op hierdie stadium word die DT’s nie aan potensiële DT-lesers voorgelê om die aanvaarbaarheid en verstaanbaarheid daarvan te toets nie, wat uiteraard voordelig vir die studie kon wees.

4. ChatGPT-4o se hantering van die vertaaluitdagings

Die DT’s word in hierdie afdeling ontleed en vergelyk. Die ontleding word volgens Nord (1997) se vertaaluitdagings gegroepeer en dan word Pym (2016) se vertaaloplossings gebruik om ChatGPT-4o se hantering van die vertaaluitdagings te bespreek.

4.1 Pragmatiese vertaaluitdagings

Pragmatiese vertaaluitdagings ontstaan weens ’n teenstelling tussen twee kommunikatiewe situasies en sluit ook pragmatiese kennis van die BT in wat nie ’n gegewe vir die DT is nie. Dit behels name soos Morningstar, The New York Times , The Wall Street Journal , LexisNexis en terminologie soos exchange-traded funds (ETFs) (De Nard e.a. 2024:1–4).

Die eerste voorbeeld van ’n pragmatiese vertaaluitdaging lyk so:

Morningstar is bekend as ’n finansiëledienstemaatskappy wat ’n verskeidenheid beleggingsnavorsings- en beleggingsbestuurdienste aanbied (Morningstar 2024). Die oplossing kopiëring in Pym (2016) se tipologie kan vir die kundige leser gevolg word omdat die kundige ’n kenner in daardie veld is en dit onnodig is om bykomende inligting by te voeg. Vir die lekeleser is dit egter belangrik om meer uit te brei oor wie of wat Morningstar is en wat hulle doen. Dus moet die implisiete kennis van Morningstar eksplisiet aan die lekeleser verduidelik word – veral omdat die vertaalopdrag vereis dat die nodige aanpassings vir die leek gemaak moet word. Volgens Pym (2016) se tipologie van vertaaloplossings stel hy kompenseer as vertaaloplossing vir hierdie doeleindes voor. In hierdie geval hanteer ChatGPT-4o dus die vertaling vir die kundige leser se beter as dié vir die leek.

Die onderstaande voorbeeld is nog ’n goeie voorbeeld van ’n pragmatiese vertaaluitdaging:

The New York Times is die naam van ’n koerant in New York en het nie ’n Afrikaanse ekwivalent nie, net soos Die Burger nie ’n Engelse ekwivalent het nie. Wat opvallend is, is dat ChatGPT-4o dié eienaam vir die kundige leser as die New York Times en vir die lekeleser as The New York Times vertaal het. Dit kom voor asof ChatGPT-4o New York Times as die eienaam beskou het en the as die bepaalde lidwoord die vir die kundige leser vertaal het. In teenstelling met hierdie vertaling kom dit voor asof ChatGPT-4o The New York Times as die vertaaleenheid vir die leek beskou het. Vervolgens is die lekevertaling die voorkeuropsie, en ChatGPT-4o kon op albei vlakke kopiëring as vertaaloplossing toegepas het.

Dieselfde tendens kan in die volgende voorbeeld waargeneem word, maar in hierdie geval is ChatGPT-4o konsekwent met die vertaling van die naam:

Nog ’n voorbeeld van ’n vertaaluitdaging wat met ’n naam te make het, is:

Volgens Pym (2016) se tipologie het ChatGPT-4o kulturele ooreenstemming gebruik om Paris Agreement as Parys-ooreenkoms te vertaal. Soos in die vorige voorbeelde het ChatGPT-4o die lidwoord die vir die kundige vertaal, maar nie vir die leek nie. Dieselfde oplossing word vir Kyoto-protokol gevolg, maar weer eens moet die name vir die leek verduidelik word deur met bykomende inligting te kompenseer . Volgens Skryf Afrikaans van A tot Z (voorts SAAZ) word programme deur die VN konvensioneel deur VN se voorafgegaan. Dus is die voorkeuropsie om eerder VN se Klimaatsveranderingkonferensie in Kopenhagen te gebruik, wat ChatGPT-4o in albei DT’s nie uitgevoer het nie.

In Ghassemiazghandi (2024:989) word daar bevind dat ChatGPT-4 die vertaling van name uitdagend vind. Die voormelde ontledings blyk Ghassemiazghandi (2024) se waarneming te staaf: ChatGPT-4o het met die eerste poging (die kundigelesersvlak) en die tweede poging (die lekelesersvlak) nie die name korrek vertaal nie, en vind dit moontlik uitdagend om te vertaal.

Die volgende voorbeeld behels terminologie wat nie teksgebonde is nie, maar eerder afsonderlik in die finansiële en klimaatveranderingsveld veralgemeen kan word:

Volgens Steyn, Smit en Vorster (2009) se English-Afrikaans glossary of statistical terms is die term heteroskedastisiteitsmodel opgeneem. Hierdie term kan op die vertaling van heteroskedasticity-consistent van toepassing wees. Die afkorting HC kan volgens Pym (2016) se tabel gekopieer word omdat dit die wiskundige voorstelling van heteroskedasticity-consistent (heteroskedastisiteitskonsekwente) is en in formules gebruik word – veral later in die BT. In Alzain e.a. (2024:840) se studie bevind hulle dat ChatGPT ’n menigte terminologiese foute in Arabies maak, en in hierdie geval bevind ons dat ChatGPT-4o terminologie in Afrikaans bevredigend hanteer. Hoewel Arabies en Afrikaans taamlik verskil, is dit interessant dat ChatGPT-4o terminologiese foute in ’n taal maak waarvan die korpus groter is as dié van Afrikaans. Nogmaals moet daar vir die leek meer verduidelik word en kompensasie as vertaaloplossing ingespan word.

’n Alternatiewe oplossing is om vir die leek te spesifiseer deur wysiging van uitdrukking as ’n oplossing in te span. Daar kan ook ’n gepaste kort beskrywing van die term gegee word, of die term kan heeltemal geskrap word met ’n goeie motivering daarby. Deur meer besonderhede vir die leek te bied, word Pym (2016) se oplossing teksaanpassing toegepas omdat daar inligting bygevoeg word. Vir die kundige is dit uiteraard nie nodig om te verduidelik nie, waar kulturele ooreenstemming as oplossing gevolg kan word.

4.2 Interkulturele vertaaluitdagings

In kulture bestaan daar verskillende stelle vaste gebruike, en ’n uitdaging ontstaan wanneer daar ’n verskil tussen dié gebruike is. Dit sluit die volgende voorbeelde in: meetbare, formele en tekssoortgebruike.

Die onderstaande voorbeeld illustreer die uitdaging tussen twee konvensies in geldeenhede:

Talle taalgebruikers sukkel met die gebruik van biljoen en miljard en vertaal dikwels billion as biljoen , wat ’n vertaalfout is. Die BT-term billion verwys na die Anglo-Amerikaanse waarde (nege nulle), en die Afrikaanse ekwivalent daarvoor is dan miljard (Pharos Woordeboek 2010a). Dus word kulturele ooreenstemming volgens Pym (2016) se tipologie gebruik. Daar word onder 4.3 (ii) ’n opmerking oor die gebruik van die en- teenoor die em-streep gemaak.

Nog kultuurgebonde interkulturele voorbeelde is die volgende:

Die benaming vir die verskynsel hurricane wissel na gelang van die wêreldligging (AJLabs 2024). Weens die verskillende benamings veroorsaak dit ’n interkulturele vertaaluitdaging in Afrikaans. In die Suidelike Halfrond word orkaan gebruik (SAAZ 2017:1.14), dus is die vertaalekwivalent wat ChatGPT-4o bied, korrek. In so ’n geval word kulturele ooreenstemming as ’n vertaaloplossing ingespan.

ChatGPT-4o het nie hierdie gedeelte vir die lekeleser vertaal nie. Daar is heelwat gevalle soos hierdie een met geen motivering waarom dit onvertaald gelaat is nie. Dit dui op ChatGPT-4o se inkonsekwentheid en staaf Lyu e.a. (2023:9) se bevinding dat ChatGPT-4 soms inligting weglaat.

’n Ander voorbeeld van ’n interkulturele uitdaging is die volgende:

In hierdie geval het ChatGPT-4o wildfires as veldbrande vir die lekeleser vertaal, en volgens Pym (2016) se tabel staan dit as kulturele ooreenstemming bekend. Volgens Stanley (2023) is ’n wildfire ’n onbeheerbare brand in verskillende ekosisteme, wat nie tot ’n spesifieke omgewing beperk is nie. ’n Veldbrand is, volgens HAT (2015), ’n brand wat onbeheerbaar is, maar wat tot ’n veld beperk is. Omdat veldbrand ’n redelik bekende term in Suid-Afrika is, is die vertaling nie soseer verkeerd nie, maar in Van den Bergh (2025:38) is daar aangedui dat dit nie werklik omvattend genoeg is nie. ’n Goeie alternatief sou wegholbrand wees, omdat dit die essensie van wat ’n wildfire is, beter vasvang.

4.3 Intertalige vertaaluitdagings

Intertalige vertaaluitdagings behels uitdagings op die grammatikale en sintaktiese vlak, wat suprasegmentele eienskappe en woordeskat insluit.

In teenstelling met byvoorbeeld Engels waar daar in die verlede tyd geskryf word, word daar in Afrikaans in die historiese teenwoordige tyd geskryf, wat dikwels uitdagings veroorsaak:

ChatGPT-4o verander was na is in die bostaande voorbeeld, en in hierdie geval moet die Afrikaanse vertaling in die historiese teenwoordige tyd geskryf word. Dus moet ChatGPT-4o kulturele ooreenstemming gebruik en die was na is vertaal vir die vertaling om bevredigend te wees, wat dié KI voldoende uitvoer.

Daarbenewens is die posisie van die hoofwerkwoord toegepas verskillend op die twee onderskeie lesersvlakke vertaal. In die vertaling vir die kundige leser word die Engelse BT-sintaksis gevolg, maar vir die leek word dit anders as vir die kundige leser se sintaksis vertaal. Volgens SAAZ (2017:7.3) word die hoofwerkwoord in Afrikaans meestal aan die einde van die sin geplaas, maar volgens Carstens (2018:47–8) kan die posisie van die werkwoord wissel na gelang van die soort sin. In hierdie voorbeeld is dit verkieslik om die werkwoord eerder aan die einde van die sin te plaas, derhalwe is die lekeleser se vertaling die voorkeuropsie.

Nog voorbeelde van intertalige vertaaluitdagings wat sintaktiese uitdagings behels, is:

ChatGPT-4o het in hierdie voorbeeld ’n paar dinge verskillend vertaal. Eerstens is die gebruik van die en-streep ( – ) en die em-streep ( — ) verskillend. In Afrikaans word die en-streep verkies bo die em-streep, wat tipies in Engels gebruik word. Volgens SAAZ (2017:9.1) word die em-streep slegs gebruik om letters in kwetsende, kru en rassistiese terme te vervang of by die weglating van skrywers se vanne in bronnelyste. ChatGPT-4o gebruik die em-streep vir die kundige leser en die en-streep vir die leek, maar die gebruik van die em-streep in hierdie vertaling is verkeerd. Die kulturele-ooreenstemmingsopsie – ook die korrekte opsie – is die en-streep.

Tweedens is daar ’n verskil in die sintaksis met die posisie van onder bestuur in die twee vertalings. Volgens Carstens (2018:48) is die basiese patroon van ’n sin in Afrikaans die volgende: subjek/onderwerp (S) + werkwoord (V) + objek/voorwerp/bepalings (O). Wanneer daar meer as een werkwoord in die sin is, word die hoofwerkwoord nader aan die einde van die sin geplaas. ’n Akademiese teks is ook formeler en daarom word ’n “formeler” sintaksis verkies, en die werkwoord word dan aan die einde van die sin geplaas (Carstens 2018:51–2). Die voorkeuropsie vir hierdie vertaling is dus om die lekeleser se sintaktiese struktuur te volg. Met behulp van Pym (2016) se wysiging van sintaktiese fokus kan hierdie vertaaluitdaging bevredigend hanteer word.

’n Ander voorbeeld wat met sintaksis te make het, is die volgende:

Hierdie voorbeeld sluit by die voorafgaande voorbeeld aan. ChatGPT-4o plaas die werkwoord word vorentoe en geassosieer aan die einde van die sin, en volg derhalwe ’n formeler sintaksis vir die kundige leser, anders as by die leek. Dit is belangrik vir veral die kundige leser om die formele struktuur te behou, want dit is ’n akademiese teks wat ’n bepaalde styl volg. Dus is die voorkeuropsie eerder die kundige se vertaling en nie dié van die lekeleser nie omdat dit ongrammatikaal is. Pym (2016) stel ook in die oplossing teksaanpassing voor dat inligting verwyder kan word, dus kan dit ook soos volg vertaal word: Dus word die alfa op enige tydstip met die nuus op daardie tydstip geassosieer, met moontlike vertragings . Wanneer daar vertaal word, hoef elke woord nie vertaal te word nie, mits die betekenis behoue bly.

’n Bykomende opvallende intertalige uitdaging is die dubbele-ontkenningsvorm in Afrikaans:

ChatGPT-4o pas deurgaans die dubbele-ontkenningsvorm, soos wat dit in Afrikaans gebruik word, in albei DT’s goed toe.

In die onderstaande voorbeeld word die gebruik van die nominale en verbale vorm geïllustreer:

In die BT word die nominale konstruksie met die -ing -agtervoegsel gebruik. ChatGPT-4o gebruik die verbale vorm in die kundige leser se vertaling, maar behou die nominale konstruksie vir die lekeleser. Die voorkeuropsie is om eerder die nominale konstruksie vir die kundige leser te gebruik omdat dit formeler as die verbale vorm is, en hiervolgens die verbale vorm vir die lekeleser te gebruik. Die vertaling van market pricing as markprysing is ’n goeie voorbeeld van ’n direkte vertaling omdat die natuurlike vertaling daarvan prysbepaling deur die mark is (Pharos Woordeboek 2010b). Die vertalings deur ChatGPT-4o is nie aanvaarbaar nie, omdat dié KI nie die gepaste vorm vir die lesers gebruik nie, en ook ’n sintetiese vertaling van market pricing bied.

In die onderstaande voorbeeld word Afrikaanse samestellings as intertalige vertaaluitdaging geïllustreer:

Dit is makliker om climate hedge portfolio te vertaal wanneer die woorde afsonderlik beskou word, veral omdat daardie woorde onderskeidelik volop in die finansiële veld gebruik word. Volgens die Nuwe Sakewoordeboek is verskans een van die vertaalekwivalente vir hedge (Pharos Woordeboek 2010c), wat ChatGPT-4o bevredigend uitvoer.

ChatGPT-4o het hedge vir die kundige leser onvertaald gelaat en die Engelse hedge gekopieer, wat foutief is omdat daar vertaalekwivalente daarvoor is. Daarom is die voorkeuropsie die lekeleser se vertaling klimaatsverskansingsportefeulje . Alzain e.a. (2024) het in hulle studie bevind dat ChatGPT heelwat terminologiese vertaalfoute maak, en in hierdie studie bevind ons dat ChatGPT-4o met die tweede poging ’n beter en akkurater vertaling as met die eerste poging gelewer het.

4.4 Teksspesifieke vertaaluitdagings

Hierdie kategorie het te make met vertaaluitdagings wat teksgebonde is en nie veralgemeen kan word nie, asook uitdagings wat nie in een van die ander kategorieë val nie.

Die volgende voorbeelde behels opskrifte en titels:

Die bostaande voorbeeld is die titel van die BT-artikel en ’n goeie voorbeeld van ’n teksspesifieke vertaaluitdaging. In Afrikaans is die verbindingsklank in samestellings volgens die AWS (2017:19.17) opsioneel (vergelyk bv. olifantstand naas olifanttand en verjaardag naas verjaarsdag ). Dus is sowel klimaatrisiko as klimaatsrisiko korrek en hang dit van persoonlike voorkeur af.

’n Uitdagende vertaling is factor-mimicking portfolios , nie net omdat dit die titel van die teks is nie, maar ook omdat daar eers verstaan moet word wat dit beteken. ’n Mimicking portfolio is ’n versameling beleggings wat gekies is om ’n bepaalde faktor na te boots (Roll en Srivastava 2018). Factor behels eienskappe van ’n belegging wat die opbrengste verduidelik, en die waarde, momentum en grootte insluit (BlackRock 2019). Kulturele ooreenstemming word in so ’n geval gebruik, daarom is ChatGPT-4o se vertaling naboots vir die kundige leser aanvaarbaar, hoewel nabootsende nog beter kan werk, omdat dit in die BT mimicking is en nie mimic nie. Vir die leek het ChatGPT-4o matigende gebruik, maar dit is nié die voorkeuropsie nie. As gevolg van die ondeursigtige titel is ’n vertaling alleen nie noodwendig voldoende nie, en moet daar volgens die oplossing teksaanpassing vir die kundige leser en vir die lekeleser ’n verduideliking gebied word.

Die bostaande voorbeeld is die opskrif van ’n afdeling in die teks wat handel oor die uitwerking wat klimaatrisikonuus op klimaatportefeuljes het, asook die verskillende maniere waarop dié nuus aangebied word. Die nominale vorm meting kan vir die kundige leser behou word omdat dit formeler is, maar vir die leek kan die verbale vorm gebruik word, byvoorbeeld: Hoe nuus oor klimaatsverandering gemeet kan word of Die meet van klimaatsveranderingsnuus . Die wysiging van uitdrukking volgens Pym (2016) se tipologie is hier ter sprake, wat die opskrif duideliker en meer verstaanbaar vir die leek maak sonder om die leek se kennisvlak te onderskat.

In die vertaling van die teks vir die lekeleser het ChatGPT-4o waarskynlik die Engelse konvensie vir hooflettergebruik in opskrifte nagevolg. In teenstelling met hierdie konvensie word slegs die eerste woord en eiename in Afrikaans met ’n hoofletter geskryf (SAAZ 2017:7.3). Vir die lekeleser is dit nie net die hooflettergebruik wat problematies is nie, maar ook die spelling 7 van klimaatsverandering Nuus , wat as samestelling klimaatsveranderingsnuus gespel moet word. Die kundige leser se vertaling is daarom die voorkeuropsie bo dié vir die leek.

Vergelyk die volgende voorbeeld:

Die vertaling van signal as signaal is foutief, veral omdat sinjaal in Afrikaans as ’n vertaling kon werk, maar nóg beter vertaalopsies is onder andere sein en teken . In dié geval stel Van den Bergh (2025:43) Die klimaatsfaktorsein voor. Wanneer die teks in sy geheel gelees en beskou word, dui signal op ’n vector : “A simple method to generate a signal (vector) [...]” (bl. 6). Daarom kan vektor ook werk, veral vir die kundige leser; dus: Die klimaatsfaktorvektor . Vir die leek kan daar by sein gehou word.

Die onderstaande voorbeeld behels teksspesifieke terminologie:

Hierdie voorbeeld toon een van die gedeeltes wat ChatGPT-4o op albei vlakke geskrap het. Dit is belangrik om hierdie geval uit te lig omdat die afkorting CEP later in die teks gebruik word in die gedeeltes wat ChatGPT-4o wel vertaal het. Die kundige leser kan dalk aflei waarna dit verwys, maar die lekeleser sal heel moontlik verward wees.

In hierdie geval is CEP teksspesifiek, omdat dit verskillende betekenisse binne verskillende (finansiële) velde het. Indien dit vertaal word, behoort die volgende te werk: klimaatsdoeltreffende faktornabootsende portefeulje (CEP) . Indien daar nie ’n Afrikaanse afkorting is nie, kan dit volgens Pym (2016) se tabel gekopieer word. Kundige lesers gebruik meer Engelse afkortings en is ook meer bewus van Engelse afkortings en die betekenis daarvan. ’n Voorbeeld is die gebruik van EFT ( electronic funds transfer ), naas EFO (elektroniese fondsoorplasing). EFT is meer bekend en word eerder in omgangstaal gebruik.

Die onderstaande voorbeeld behels teksspesifieke formules:

